Question,Answer,Documents
맞춤형 기초생활보장 제도에서 저소득층 외국인의 지원 자격에 관해 설명해 줄래?,"저소득층 외국인은 한국인과 결혼했거나 이혼, 배우자 사망 후 한국인 배우자의 부모 또는 조부모, 자녀, 손자녀를 부양하고 있을 경우 맞춤형 기초생활보장 제도의 지원을 받을 수 있습니다.",맞춤형 기초생활보장 제도
한국인과 결혼한 외국인이 복지 혜택을 받기 위해 충족해야 하는 조건은 무엇인가요?,"한국인과 결혼하여 그 가족을 돌보고 있고, 소득인정액이 급여별 선정기준 이하일 경우 맞춤형 기초생활보장 제도의 대상이 될 수 있습니다.",맞춤형 기초생활보장 제도
맞춤형 기초생활보장 제도에서 한국인 배우자의 사망 후 외국인 부양자가 돌보아야 하는 가족 범주에 포함되는 사람은 누구인가요?,"배우자의 사망으로 한국인 부모, 조부모, 자녀, 또는 손자녀를 돌보는 외국인은 맞춤형 기초생활보장 제도의 지원 대상에 포함됩니다.",맞춤형 기초생활보장 제도
외국인이 이혼 후에도 한국 복지 혜택을 받을 수 있는 조건은 어떻게 되나요?,"이혼 후 한국인 전 배우자의 가족을 부양하면서 생활이 어려운 경우, 본인의 소득이 급여별 선정기준에 미치지 못하면 맞춤형 기초생활보장 제도 혜택을 받을 수 있습니다.",맞춤형 기초생활보장 제도
한국인 자녀를 돌보고 있는 외국인이 맞춤형 기초생활보장 제도의 혜택을 신청하려면 어떤 재정적 기준을 충족해야 하나요?,한국인 자녀를 돌보고 있는 외국인이 맞춤형 기초생활보장 제도를 신청하기 위해서는 자신의 소득인정액이 해당 급여별 선정기준 이하인 저소득층에 해당해야 합니다.,맞춤형 기초생활보장 제도
맞춤형 기초생활보장 제도에서 외국인 부양자의 급여별 선정기준은 어떻게 결정되나요?,"급여별 선정기준은 저소득층 외국인 가구의 소득과 재산을 판단하여 결정되며, 구체적인 기준은 맞춤형 기초생활보장 제도의 정책에 따라 달라질 수 있습니다.",맞춤형 기초생활보장 제도
,대한민국에서 생활이 어려운 세대를 위한 지원으로는 어떤 것들이 있나요?,
"대한민국에서는 경제적으로 어려움을 겪는 세대를 위해 생계급여, 주거급여, 교육급여, 해산급여 및 장제급여, 의료급여, 자활급여 등의 지원을 제공합니다. 이는 맞춤형 기초생활보장 제도의 일환으로 시행됩니다.",맞춤형 기초생활보장 제도,
제가 교육급여 신청 자격이 될까요? 어떤 조건을 충족해야 하나요?,,교육급여는 소득과 재산 기준이 일정 수준 이하인 가구의 학생들에게 지원됩니다. 신청 자격을 알기 위해서는 가까운 주민센터에 문의하거나 맞춤형 기초생활보장 제도 관련 웹사이트에서 자세한 정보를 확인할 수 있습니다.
맞춤형 기초생활보장 제도,,질병으로 인해 수입이 없어졌어요. 어떻게 지원받을 수 있나요?
,질병으로 인해 수입이 없어졌다면 의료급여를 포함한 맞춤형 기초생활보장 제도를 통해 지원을 받을 수 있습니다. 자격요건을 충족하는지 주민센터를 통해 상담 받으시길 권장드립니다.,맞춤형 기초생활보장 제도
,임신 중인데 해산급여는 어떻게 신청하나요?,
"해산급여는 임신 중인 저소득층 여성을 대상으로 하며, 신청은 주민센터에서 할 수 있습니다. 자세한 절차와 자격 요건은 가까운 주민센터 또는 맞춤형 기초생활보장 제도 안내 웹사이트에서 확인하세요.",맞춤형 기초생활보장 제도,
주거급여를 받으려면 어떤 절차를 거쳐야 하나요?,,"주거급여 신청은 가구의 소득과 재산 기준을 충족해야 하며, 신청은 거주하는 지역의 주민센터를 통해 접수할 수 있습니다. 필요 서류와 구체적인 신청 절차는 주민센터에 문의하여 안내받을 수 있습니다."
맞춤형 기초생활보장 제도,,사망한 가족의 장제급여 지원을 받고 싶은데 어디서 알아볼 수 있나요?
,"장제급여는 경제적으로 어려움을 겪는 가구에 대한 지원으로, 가까운 주민센터에서 자격 요건과 신청 방법에 대해 안내받을 수 있습니다. 관련 문서 준비와 조건을 사전에 확인하는 것이 중요합니다.",맞춤형 기초생활보장 제도
만약 저소득층 생활 보장을 원한다면 어떻게 신청해야 하나요?,저소득층을 위한 맞춤형 기초생활보장 제도는 가까운 읍면동 주민센터(행정복지센터)를 방문하여 안내를 받고 신청할 수 있습니다.,맞춤형 기초생활보장 제도
"기초생활보장 제도에 관심이 있는데, 어디서 어떻게 도움을 받을 수 있나요?","기초생활보장 제도에 대한 정보와 도움은 귀하의 거주지 읍면동 주민센터(행정복지센터)에서 제공받으실 수 있으며, 직접 방문하여 신청 절차를 진행하시면 됩니다.",맞춤형 기초생활보장 제도
생계가 어려워서 정부의 지원이 필요해요. 어디로 가야 하나요?,"정부 지원을 원하시는 경우, 귀하의 거주 지역에 있는 읍면동 주민센터(행정복지센터)를 찾아가 상담을 받고 맞춤형 기초생활보장 제도의 신청 절차에 대해 안내를 받으세요.",맞춤형 기초생활보장 제도
기초생활보장제도 내에서 생계지원을 받으려면 어디로 연락해야 하나요?,생계급여에 관한 문의는 보건복지상담센터로 연락하시면 도움을 받으실 수 있습니다.,맞춤형 기초생활보장 제도
의료비 지원이 필요한데 기초생활보장제도를 어떻게 신청하나요?,의료급여와 관련하여 보건복지상담센터에 문의하시면 자세한 절차와 필요한 정보를 안내받으실 수 있습니다.,맞춤형 기초생활보장 제도
집을 구할 때 주거급여 혜택은 어떻게 받을 수 있나요?,주거급여에 대해서는 주거급여 콜센터나 LH마이홈에 연락하시면 상세한 안내를 받으실 수 있습니다.,맞춤형 기초생활보장 제도
저소득층 아이들의 학비 지원은 어디서 알아볼 수 있나요?,교육급여 관련 정보는 한국장학재단 교육급여 바우처 콜센터를 이용하시면 됩니다.,맞춤형 기초생활보장 제도
기초생활보장제도의 주거지원 혜택을 받기 위해선 어떤 절차를 거쳐야 하나요?,주거급여 신청 절차와 조건에 대해서는 주거급여 콜센터 또는 LH마이홈을 통해 자세한 정보를 얻을 수 있습니다.,맞춤형 기초생활보장 제도
"저소득층 학생을 위한 교육지원금 제도가 있다고 들었는데, 신청할 수 있는 기관이 따로 있나요?",교육급여에 대한 자세한 내용이나 신청 방법은 한국장학재단 교육급여 바우처 콜센터로 문의하시면 안내받으실 수 있습니다.,맞춤형 기초생활보장 제도
만약 나에게 주거문제가 있어서 금전적인 지원이 필요할 때 어디에 문의해야 하나요?,주거급여 관련하여 지원을 받고자 하시면 주거급여 콜센터인 1600-0777로 문의하시면 됩니다.,맞춤형 기초생활보장 제도
아팠을 때 또는 건강 관련 문제로 도움을 받고자 할 때 어느 기관에 연락해야 하나요?,건강이나 복지 관련 문제로 상담이 필요하시면 보건복지상담센터 129번으로 전화하여 도움을 요청하시면 됩니다.,맞춤형 기초생활보장 제도
LH마이홈 서비스에 대해서 알고 싶은데 어떻게 연락하면 좋을까요?,LH마이홈 서비스에 대한 문의는 1600-1004로 전화하시거나 www.myhome.go.kr을 통해 온라인으로 정보를 얻으실 수 있습니다.,맞춤형 기초생활보장 제도
교육비 지원을 받으려면 어디로 연락해야 하나요?,교육급여 바우처와 관련된 지원을 받기 위해서는 한국장학재단 교육급여 콜센터인 1599-2000번으로 문의해주세요.,맞춤형 기초생활보장 제도
"긴급하게 복지 상담을 받아야 하는데, 어느 번호로 연락해야 하죠?",긴급한 복지 상담이 필요하시면 129번 보건복지상담센터로 전화하시면 상담받으실 수 있습니다.,맞춤형 기초생활보장 제도
내가 받을 수 있는 주택 관련 혜택에 관해 알아보고 싶어요. 어디에 문의해야 하죠?,주택 관련 혜택에 대해 알아보시려면 LH마이홈 콜센터 1600-1004로 연락하거나 해당 웹사이트를 방문하시면 상담 및 안내를 받으실 수 있습니다.,맞춤형 기초생활보장 제도
