Question,Answer,Documents
"한국에서 일하는 외국인인데요, 저 같은 경우에 어떻게 의료 지원을 받을 수 있나요?","한국에서 일하는 외국인으로 의료 지원이 필요하시다면, 국립중앙의료원 공공보건의료지원센터(전화번호 02-6362-3751)로 문의하시면 안내를 받으실 수 있습니다.",외국인근로자 등 의료지원
비상 사태에서 외국인 근로자가 헤매지 않고 바로 의료 도움을 받으려면 어떻게 해야 할까요?,긴급한 상황에서 외국인 근로자가 신속하게 의료 도움을 받으려면 보건복지상담센터(129)로 즉시 전화하시면 됩니다.,외국인근로자 등 의료지원
아플 때 병원비 부담이 큰데 어떻게 하면 좋을까요?,"건강보험에 가입되어 있지 않은 외국인근로자의 경우 의료비 부담을 줄일 수 있는 '외국인근로자 의료지원제도'를 활용해 볼 수 있습니다. 이 제도는 본인부담 의료비를 지원하며, 자격 요건과 신청 방법에 대해 관할 보건소에 문의하여 자세히 알아보시는 것이 좋습니다.",외국인근로자 등 의료지원
돌봄이 필요한 부모님을 위해 어떤 서비스를 이용할 수 있나요?,고령이신 부모님을 위해 '노인장기요양보험제도'를 이용할 수 있습니다. 이 제도는 노인의 일상생활 지원 및 간병 서비스를 제공하여 가족의 부담을 줄이고 노인의 삶의 질을 향상시키는 데 목적이 있습니다. 가까운 보건소 또는 노인장기요양보험 홈페이지를 통해 자격 심사를 신청하고 필요한 서비스를 안내받으실 수 있습니다.,외국인근로자 등 의료지원
저소득층 아이들을 위한 교육 지원 프로그램이 있나요?,"저소득 가정의 어린이들을 위하여 '교육복지우선지원사업'이라는 제도가 있습니다. 이 사업은 학업 성취도 향상, 정서 안정, 건강한 성장을 지원하는 다양한 프로그램을 운영하는 것으로, 해당 지역의 교육청이나 학교에서 좀 더 자세한 정보를 제공받으실 수 있습니다.",외국인근로자 등 의료지원
원자폭탄 피해 경험이 있는 분들을 위한 복지 혜택이 있는지 궁금해요.,"네, 원폭피해자를 대상으로 하는 복지 혜택이 있습니다. 구체적인 지원 내용과 자격 요건에 대해 알아보시는 것이 좋겠습니다.",원폭피해자 지원
"제 친할아버지께서 원폭으로 피해를 입으셨는데, 어떤 도움을 받을 수 있나요?","할아버지께서 원폭 피해자로 인정된다면, 관련 복지제도를 통해 다양한 지원을 받으실 수 있습니다. 해당 지원 서비스를 확인하시려면 가까운 지자체 복지 담당 부서나 관련 기관에 문의하셔야 합니다.",원폭피해자 지원
원자폭탄 피해로 고통받고 계신 어르신들은 어떤 복지 혜택이 제공되나요?,"원자폭탄 피해자로 인정되는 어르신들은 특별한 의료지원, 생활안정 지원 등의 복지 혜택을 제공받게 됩니다. 자세한 사항은 관할 지방자치단체나 원폭피해자 지원단체에 문의하여 확인하실 수 있습니다.",원폭피해자 지원
원자폭탄 피해를 겪은 분들에게 진료비 부담은 어떻게 지원되나요?,건강수첩을 갖고 있지 않은 원폭피해자의 경우 요양급여 본인부담금 전액이 지원됩니다.,원폭피해자 지원
원폭피해자에게 분기별로 지급되는 진료보조비의 액수는 얼마인가요?,분기별로 원폭피해자는 매월 10만 원의 진료보조비를 받게 됩니다.,원폭피해자 지원
원폭피해자복지회관에 입소한 피해자는 매월 얼마의 지원금을 받나요?,원폭피해자복지회관에 입소한 피해자는 매월 5만 원을 지원받습니다.,원폭피해자 지원
"원폭피해자 장제비 지원금은 얼마이며, 어떻게 지급되나요?",장제비는 원폭피해자에게 210만 원으로 일시에 지급됩니다.,원폭피해자 지원
원자폭탄 피해자의 경우 진료 비용 부담이 어떻게 줄어드나요?,건강수첩이 없는 원자폭탄 피해자에게는 요양급여 시 본인이 부담해야 할 금액 전액을 지원해 줍니다.,원폭피해자 지원
복지회관 입소 원폭피해자에게 제공되는 추가 혜택에 대해 설명해주세요.,원폭피해자복지회관에 입소하는 피해자들에게는 매월 추가로 5만 원이 지원됩니다.,원폭피해자 지원
원자폭탄 피해를 입은 사람들이 지원을 받으려면 어떤 절차를 밟아야 하나요?,원자폭탄 피해자 분들은 대한적십자사에 문의하여 지원을 신청하실 수 있습니다.,원폭피해자 지원
원폭피해자를 위한 지원 상담은 어디서 받을 수 있나요?,"원폭피해자의 경우, 대한적십자사를 통해 지원 상담을 받으실 수 있습니다.",원폭피해자 지원
대한적십자사를 통한 원폭 피해 지원 신청 절차에 대한 정보를 얻으려면 어떻게 해야 하나요?,원폭 피해를 당하신 분들은 대한적십자사에 연락하여 지원 신청 절차에 대한 정보를 받으실 수 있습니다.,원폭피해자 지원
원자폭탄 피해 경험자가 받을 수 있는 지원이 있나요?,"네, 원폭피해자분들은 대한적십자사를 통해 지원을 신청하실 수 있습니다. 다양한 구호 활동 및 욕구에 맞춘 서비스를 제공받으실 수 있습니다.",원폭피해자 지원
"제 조부모님이 원폭 피해를 겪었는데, 어떤 도움을 받을 수 있는지 알고 싶어요.",대한적십자사에서는 원폭피해자를 위한 적절한 지원 프로그램을 운영하고 있습니다. 조부모님의 구체적인 상황에 맞춰 필요한 정보 및 서비스 안내를 받으실 수 있어요.,원폭피해자 지원
원자력재해로 인한 피해자들에게 주어지는 특별한 보상 체계가 있습니까?,"네, 원자력 재해로 인한 피해자들을 위한 지원은 대한적십자사를 통해 이루어집니다. 그곳에서는 필요한 보상과 지원 서비스에 관한 상담을 받아보실 수 있습니다.",원폭피해자 지원
대한적십자사와 관련된 문의를 하고 싶은데 어떤 전화번호로 연락해야 하나요?,대한적십자사에 문의를 하기 위해서는 02-3705-3783으로 전화하시면 됩니다.,원폭피해자 지원
만약 원폭 피해자 지원에 대해 알아보고 싶다면 어디로 연락해야 하나요?,원폭 피해자 지원에 대한 정보를 얻기 위해서는 대한적십자사의 전화번호 02-3705-3783으로 연락하면 도움을 받으실 수 있습니다.,원폭피해자 지원
원자폭탄 피해자에게 도움을 주는 기관의 연락처를 알려주세요.,"원자폭탄 피해자를 돕는 기관인 대한적십자사로 연락하시려면, 02-3705-3783으로 전화하시면 됩니다.",원폭피해자 지원
의사자 유족에게 제공되는 복지 혜택에는 어떤 것들이 있나요?,"의사자 유족을 위한 복지 혜택에는 정부가 제공하는 금전적 지원, 교육 지원, 보험 및 의료 혜택, 고용 우대와 같은 다양한 서비스가 포함됩니다.",의사상자 등 지원
의상자 가족들이 받을 수 있는 지원 내용을 설명해주세요.,"의상자의 가족들은 의료비 지원, 자녀 교육비 지원, 생활 안정을 위한 수당 등 다방면에서 정부로부터 지원을 받을 수 있습니다.",의사상자 등 지원
의사자 지원 제도를 이용하고자 할 때 어떤 절차를 거쳐야 하나요?,"의사자 지원 제도를 이용하기 위해서는 먼저 관련 기관에 의사자로 인정받아야 하며, 이후 필요 서류를 준비하여 지원 신청을 하고, 기관의 심사를 받는 절차가 이어집니다.",의사상자 등 지원
정부에서 제공하는 의사상자 유족 지원금의 23년 기준 액수는 얼마인가요?,"2023년 기준 의사자 유족 보상금은 2억 2,882만 3,000원입니다.",의사상자 등 지원
직무 외의 구조행위로 인해 발생하는 의상자란 무엇인가요?,직무 외의 구조행위로 인해 부상을 입어 인정받은 사람을 의상자라고 합니다.,의사상자 등 지원
의사상자 인정 결정 통보를 받은 후 지급 신청까지 얼마나 시간이 주어지나요?,의사상자 인정 결정을 통보받은 날로부터 3년 이내에 신청할 수 있습니다.,의사상자 등 지원
의상자에 대한 차등지원이란 무엇을 의미하나요?,의상자에 대해서는 부상의 심각도에 따른 등급별로 차등하여 보상금을 지급하는 것을 의미합니다.,의사상자 등 지원
의사자 유족 외에 어떤 유형의 인물이 의료급여와 같은 추가적인 지원 혜택을 받을 수 있나요?,의상자 1급 이상 6급이하 본인 및 그 가족도 의료급여 등의 지원 혜택을 받을 수 있습니다.,의사상자 등 지원
의사상자에게 주어지는 예우와 지원에는 어떤 것들이 포함되어 있나요?,"의료급여, 교육보호, 장제보호, 취업보호, 공직진출 가산점 등 다양한 예우와 지원이 포함되어 있습니다.",의사상자 등 지원
한국에서 의사상자 인정 절차를 시작하려면 어떻게 해야 하나요?,의사상자 인정 절차는 주소지 또는 사건이 발생한 시군구에 인정 신청을 하는 것으로 시작됩니다.,의사상자 등 지원
의사상자 인정을 위한 사실조사는 어떤 기관에서 진행하나요?,"의사상자 인정을 위한 사실조사는 시군구, 시도, 그리고 보건복지부에 의해 진행됩니다.",의사상자 등 지원
의사상자 심사의결 과정은 어떤 과정을 거치나요?,의사상자 심사의결 과정은 보건복지부의 의사상자심사위원회에서 심사와 의결을 거쳐 의사상자 인정여부가 결정됩니다.,의사상자 등 지원
의사상자 인정 결과는 어떻게 통보받을 수 있나요?,"의사상자 인정 결과는 보건복지부, 시도, 시군구를 통해 통보받게 됩니다.",의사상자 등 지원
의사상자 신청 후 인정 결과를 받기까지 어떤 단계를 거쳐야 하나요?,"의사상자 신청 후에는 신청 접수, 사실조사 확인, 의사상자심사위원회 심의, 그리고 인정여부 결정과 통보의 단계를 거치게 됩니다.",의사상자 등 지원
내가 사는 지역에서 발생한 사고로 인해 의사상자 지원을 받으려면 어디로 신청해야 하나요?,사고가 발생한 시군구에 의사상자로 인정받기 위한 신청을 해야 합니다.,의사상자 등 지원
의사상자 지원을 받고 싶은데 어디로 연락해야 하나요?,의사상자 지원에 대하여는 귀하의 거주 지역 내 시군구청의 사회복지 관련 부서나 보건복지상담센터(국번 없이 129)로 문의하시면 도움을 받으실 수 있습니다.,의사상자 등 지원
"저는 보훈대상자인데, 관련 복지 혜택을 어떻게 안내받을 수 있나요?",보훈대상자이신 분은 지역의 시군구청 사회복지 관련 부서나 보건복지상담센터로 문의하시면 관련 복지 혜택에 대한 상세한 안내 및 지원을 받으실 수 있습니다.,의사상자 등 지원
"나는 상이군경인데, 복지 서비스에 대해 자세히 알고 싶어요. 어디서 상담할 수 있을까요?",상이군경 복지 서비스에 대한 자세한 정보는 가까운 시군구청의 사회복지 담당 부서에 문의하시거나 보건복지상담센터를 이용하시면 원하시는 정보와 지원을 받으실 수 있습니다.,의사상자 등 지원
"제가 복지 관련 문의를 할 게 있는데, 보건복지상담센터에 연락하고 싶어요. 어떤 번호로 전화해야 하나요?",복지 관련 문의를 위해 보건복지상담센터로 연락하시려면 129번으로 전화하시면 됩니다.,의사상자 등 지원
"급하게 복지 정보가 필요한데, 정부 담당 부서에 어디로 전화해야 빠르게 상담받을 수 있을까요?",긴급한 복지 정보가 필요하시면 보건복지상담센터 129번으로 바로 전화하시면 상담을 받으실 수 있습니다.,의사상자 등 지원
"보건복지 문제로 상담을 받아야 하는데, 관련 센터의 연락처를 찾고 있어요. 어디로 연락하면 되나요?",보건복지 문제에 대한 상담을 원하신다면 보건복지상담센터의 전화번호 129번을 이용해주세요.,의사상자 등 지원
이동식 놀이교실을 시작하고 싶은 지방자치단체는 어떤 절차를 거쳐야 하나요?,"이동식 놀이교실을 운영하려는 지방자치단체는 시, 도지사 및 시장, 군수가 해당 프로그램 운영을 위해 신청을 하여야 합니다. 구체적인 절차 및 요건은 해당 지자체의 교육 및 보육 담당 부서로 문의하여 상세 안내를 받을 수 있습니다.",이동식 놀이교실
육아종합지원센터에서 이동식 놀이교실을 맡으려면 무슨 조건이 필요한가요?,"육아종합지원센터가 이동식 놀이교실을 위탁 운영하고자 한다면, 위탁 운영자로서의 자격 요건을 충족해야 합니다. 이는 지역사회의 보육 서비스 품질 개선과 육아 지원을 위한 다양한 프로그램 운영 능력을 포함할 수 있으며, 구체적인 조건은 관할 지자체나 보육 담당부서에 문의하여 확인할 수 있습니다.",이동식 놀이교실
이동식 놀이교실 지원을 받기 위한 첫 단계는 무엇입니까?,"이동식 놀이교실 지원을 받기 위한 첫 단계는 지원 자격을 가지고 있는 시, 도지사, 시장, 군수 혹은 육아종합지원센터 등의 위탁 운영자가 되어야 합니다. 그 후, 관련 기관에 운영 계획서와 함께 신청을 하여 프로그램 운영을 위한 지원을 요청해야 합니다.",이동식 놀이교실
이동식 놀이교실 사업을 운영하려면 어느 정도의 비용 지원을 받을 수 있나요?,"최대 1억 5,200만 원의 운영비를 지원받을 수 있습니다.",이동식 놀이교실
농촌마을 아이들에게 이동식 놀이교실이 제공하는 프로그램에는 어떤 것들이 있을까요?,차량을 이용해 방문하여 제공하는 놀잇감 및 도서 대여와 보육프로그램이 있습니다.,이동식 놀이교실
이동식 놀이교실 프로그램의 차량 사용은 어떻게 지원되나요?,프로그램 운영을 위한 차량 임차료가 지원됩니다.,이동식 놀이교실
이동식 놀이교실에서 근무하는 직원들의 인건비는 지원이 가능한가요?,"네, 필요한 인건비 역시 지원을 받을 수 있습니다.",이동식 놀이교실
이동식 놀이교실 운영에 필요한 예산 항목에는 무엇이 포함되나요?,"운영비 지원에는 인건비, 차량 임차료 등이 포함됩니다.",이동식 놀이교실
"놀이교실 차량이 농촌 지역을 방문할 때, 어떤 서비스를 제공하나요?",농촌 마을 아이들에게 놀잇감 및 도서를 대여하고 보육프로그램을 제공합니다.,이동식 놀이교실
이동식 놀이교실 사업 신청은 어떻게 하나요?,이동식 놀이교실 사업 신청은 매년 농림축산식품부가 정한 기간에 지역자치단체에 제출할 수 있습니다.,이동식 놀이교실
농림축산식품부가 정하는 신청 기간 외에도 이동식 놀이교실을 신청할 수 있는 방법이 있나요?,"아니요, 이동식 놀이교실의 신청은 오직 농림축산식품부가 정하는 기간 내에 지자체를 통해서만 가능합니다.",이동식 놀이교실
농림축산식품부 지정 기간에 이동식 놀이교실을 신청하지 못했다면 어떻게 해야 하나요?,만약 그 기간을 놓쳤다면 다음해 농림축산식품부가 새롭게 정하는 신청 기간까지 기다려야 합니다.,이동식 놀이교실
이동식 놀이교실을 신청하고 싶어요. 어디서 상담을 받을 수 있나요?,이동식 놀이교실에 대한 신청 및 상담은 관할 지자체의 농정과를 통해 가능합니다. 해당 지자체에 문의하시면 자세한 안내를 받으실 수 있습니다.,이동식 놀이교실
"마을에 돌아다니는 유아 대상 교구 서비스를 받고 싶은데, 연락해야 하는 곳을 모르겠어요.","유아를 위한 이동식 교육 서비스인 이동식 놀이교실에 대해 관심이 있으시다면, 해당 서비스를 담당하는 지자체 농정과에 문의하시면 도움을 받으실 수 있습니다.",이동식 놀이교실
지역 사회에서 운영하는 이동하는 어린이 교실 프로그램에 대해 알고 싶어요. 어느 부서에 연락해야하죠?,지역 내에서 이동하며 운영되는 어린이 교실 프로그램인 이동식 놀이교실에 대한 정보는 담당하는 지방 자치 단체의 농정과에 문의하시면 안내받으실 수 있습니다. 그곳에서 관련 절차와 상세한 정보를 제공받을 수 있습니다.,이동식 놀이교실
일본군 위안부 피해자를 지원하기 위한 생활안정 지원금을 받으려면 어떤 조건이 필요한가요?,일본군 위안부 피해자 생활안정 지원금을 받기 위해서는 정부에 등록된 일본군 위안부 피해자여야 합니다.,일본군 위안부 피해자 생활안정 및 기념사업
등록된 일본군 위안부 피해자들을 위한 기념사업에는 어떤 것들이 있나요?,"기념사업에는 피해자들의 역사를 기억하고 기념하는 공간 조성, 역사 자료 수집 및 전시, 관련 교육 및 홍보 활동 등이 포함됩니다.",일본군 위안부 피해자 생활안정 및 기념사업
생활안정 및 기념사업에 대한 정보를 어디에서 얻을 수 있나요?,해당 사업에 대한 자세한 정보는 보건복지부 또는 관련 지원단체의 공식 웹사이트를 통해 얻을 수 있습니다.,일본군 위안부 피해자 생활안정 및 기념사업
일본군 위안부 피해자 분들께 한 번에 지급되는 특별지원금 액수는 얼마인가요?,"특별지원금으로 한 번에 4,300만 원을 지원받게 됩니다.",일본군 위안부 피해자 생활안정 및 기념사업
매달 지급되는 생활안정지원자금의 금액은 몇 원인지 설명해 주실 수 있나요?,"생활안정지원자금으로 매월 170만 7,000원씩 지급됩니다.",일본군 위안부 피해자 생활안정 및 기념사업
위안부 피해자분들의 간병비는 월 얼마씩 지원되고 있나요?,"간병비는 월 평균 312만 6,000원이 지원됩니다.",일본군 위안부 피해자 생활안정 및 기념사업
"위안부 피해자분들이 치료비 지원을 받으실 때, 건강치료비로는 월 평균 얼마를 받을 수 있나요?",건강치료비로 월 평균 약 300만 원이 지원됩니다.,일본군 위안부 피해자 생활안정 및 기념사업
피해자 분들의 장례비 지원 금액은 대략 얼마나 되나요?,장례비는 1인당 약 500만 원 내외로 지원됩니다.,일본군 위안부 피해자 생활안정 및 기념사업
위안부 피해자를 위한 맞춤형 지원 중 법률상담 외에 어떤 서비스가 있다고 하셨나요?,"정서적 지원을 위한 정기 및 수시 연락, 맞춤형 지원, 호스피스, 완화의료, 생활환경 개선 등의 지원이 제공됩니다.",일본군 위안부 피해자 생활안정 및 기념사업
일본군 위안부 피해자 관련 지원 사업을 신청하고 싶어요. 어디서 신청해야 하나요?,일본군 위안부 피해자 지원 사업에 대한 신청은 거주지가 속해있는 관할 시군구청에서 가능합니다. 해당 지역의 공공 기관에 문의하여 필요한 절차를 안내받으시길 바랍니다.,일본군 위안부 피해자 생활안정 및 기념사업
"할머니가 일본군 위안부 피해자인데요, 정부의 지원 프로그램을 알고 싶습니다. 신청 절차를 알려주세요.",일본군 위안부 피해자분을 위한 정부 지원 프로그램에 대해서는 관할 시군구청을 통해 자세한 안내를 받을 수 있습니다. 직접 방문하시거나 연락처를 통하여 신청 절차에 대한 정보와 필요 서류 등을 문의하시면 됩니다.,일본군 위안부 피해자 생활안정 및 기념사업
"위안부 기념사업에 참여하고 싶은데, 신청 방법을 모르겠어요. 어떻게 해야 하죠?","위안부 피해자 기념사업에 참여를 원하신다면, 귀하의 주소지를 관할하는 시군구청에 연락하여 신청 방법에 관한 안내를 받으세요. 주로 지역 내의 문화나 복지 담당 부서를 통해 관련 정보를 제공받을 수 있습니다.",일본군 위안부 피해자 생활안정 및 기념사업
일본군 위안부 피해자 지원을 받으려면 어디에 문의해야 하나요?,일본군 위안부 피해자 지원 관련 문의는 가까운 시군구청이나 읍면동 주민센터(행정복지센터)에 하시면 도움을 받으실 수 있습니다.,일본군 위안부 피해자 생활안정 및 기념사업
위안부 피해 할머니들을 위한 복지 프로그램을 알려주실 수 있나요?,위안부 피해 할머니들을 위한 생활안정 지원 및 기념사업은 관할 지역의 시군구청 또는 읍면동 주민센터에서 안내해드릴 것입니다.,일본군 위안부 피해자 생활안정 및 기념사업
우리 동네에서 일본군 위안부 할머니들을 위해 어떻게 도울 수 있을까요?,지역 커뮤니티에서 일본군 위안부 할머니들에게 제공되는 서비스나 지원사업에 대한 정보는 해당 지역의 시군구청이나 읍면동 주민센터를 통해 문의하시면 자세히 안내받을 수 있습니다.,일본군 위안부 피해자 생활안정 및 기념사업
소규모 사업장에서 일하는 사람 중 누가 두루누리 사회보험료 지원 혜택을 받을 수 있나요?,"10인 미만 사업장에서 근로하는 월 평균 보수 260만 원 미만의 신규 가입 근로자, 예술인, 노무제공자와 그 사업주가 혜택을 받을 수 있습니다. 단, 6개월 이내 보험 가입 이력이 없는 경우에 한합니다.","저임금 근로자, 예술인, 노무제공자 사회보험료 지원(두루누리)"
예술인이 대규모 사업장에서 일하고 있다면 두루누리 지원 대상일까요?,"네, 10인 이상 사업에서 근로하는 예술인 중 월 평균 보수가 260만 원 미만인 경우에는 대상이 될 수 있습니다.","저임금 근로자, 예술인, 노무제공자 사회보험료 지원(두루누리)"
두루누리 사회보험료 지원을 받기 위한 보험 가입 이력에 관한 조건이 궁금합니다.,"지원 받으려면 6개월 이상 보험가입 이력이 없어야 하며, 해당 조건은 신규가입 근로자에게만 적용됩니다.","저임금 근로자, 예술인, 노무제공자 사회보험료 지원(두루누리)"
두루누리 사회보험료 지원의 신규 가입자 기준이 무엇인가요?,신규 가입자는 최근 6개월 동안 사회보험에 가입한 이력이 없는 근로자를 의미합니다.,"저임금 근로자, 예술인, 노무제공자 사회보험료 지원(두루누리)"
일용 근로자도 두루누리 사회보험료 지원을 받을 수 있나요?,"아니요, 일용 근로자는 두루누리 사회보험료 지원 대상에서 제외됩니다.","저임금 근로자, 예술인, 노무제공자 사회보험료 지원(두루누리)"
사업주도 두루누리 사회보험료 지원을 받을 수 있나요?,"예, 월 평균 보수가 260만 원 미만인 사업주이며, 10인 미만 근로자를 고용하는 소규모 사업장의 사업주는 지원 대상에 포함됩니다.","저임금 근로자, 예술인, 노무제공자 사회보험료 지원(두루누리)"
두루누리 사회보험료 지원 제도는 어떤 대상자에게 80%의 보험료를 지원하는 건가요?,"이 제도는 사업주 및 신규가입 근로자, 예술인, 노무제공자에게 부담하는 사회보험료의 80%를 지원합니다. 근로자에게는 고용보험과 국민연금이, 예술인과 노무제공자에게는 고용보험료가 지원됩니다.","저임금 근로자, 예술인, 노무제공자 사회보험료 지원(두루누리)"
제가 만약 고액의 재산을 보유하고 있다면 두루누리 제도의 보험료 지원을 받을 수 없나요?,"네, 만약 전년도 재산과세 표준액의 합계가 6억 원 이상이거나 전년도 혹은 전전년도 종합소득이 연 4,300만 원 이상일 경우 고액자산가로 분류되며, 두루누리 제도의 보험료 지원은 제한됩니다.","저임금 근로자, 예술인, 노무제공자 사회보험료 지원(두루누리)"
두루누리 지원을 받기 위한 신청 절차는 어떻게 되나요?,"사업주가 보험료 지원을 위한 신청을 해야 하며, 지원은 신청일이 속한 달부터 적용됩니다. 단순히 보험에 가입된 상태라고 자동으로 지원되는 것은 아닙니다.","저임금 근로자, 예술인, 노무제공자 사회보험료 지원(두루누리)"
두루누리 제도는 예술인도 지원 대상인가요? 그렇다면 어떤 보험료를 지원받을 수 있나요?,"예, 예술인도 지원 대상에 포함되며, 고용보험료에 대한 지원을 받을 수 있습니다.","저임금 근로자, 예술인, 노무제공자 사회보험료 지원(두루누리)"
