Question,Answer,Documents
산업재해 후에 장해가 남은 근로자가 장해등급에 따라 받을 수 있는 연금과 일시금의 차이는 무엇인가요?,"장해등급에 따라 장해보상연금은 1급부터 7급까지 지급되고, 일시금은 4급부터 14급까지 지급됩니다. 4급 이상 7급 미만은 연금과 일시금 중 선택이 가능합니다.",산업재해 보상보험 제도
산재 환자가 치료 중이며 약제와 수술비 지원을 받을 수 있는 급여의 명칭은 무엇인가요?,"요양급여는 산재 환자가 치료 중인 경우 약제, 수술 비용 등을 지원받는 급여입니다.",산업재해 보상보험 제도
산업재해로 인하여 간병이 필요할 때 받을 수 있는 급여는 무엇인가요?,간병급여는 산재로 인한 상병 치료 후 간병이 필요한 경우 지급되는 급여입니다.,산업재해 보상보험 제도
산재보험 급여를 신청하고 싶은데 어디로 가야 하나요?,근로복지공단 지사에 방문하여 산재보험 급여 신청이 가능합니다.,산업재해 보상보험 제도
근로자가 직장에서 다쳤을 때 받을 수 있는 보험급여는 어떻게 신청하나요?,근로복지공단 지사를 통해 산업재해 보상보험 제도에 따른 보험급여 신청을 진행할 수 있습니다.,산업재해 보상보험 제도
회사에서 다친 경우 필요한 보험 혜택을 받기 위한 절차가 무엇인가요?,산업재해 보상보험 제도 내에서 필요한 급여는 근로복지공단 지사를 통해 신청하는 절차를 거치면 됩니다.,산업재해 보상보험 제도
산업재해가 발생했을 때 어디로 연락해야 하나요?,산업재해가 발생했을 경우 근로복지공단으로 연락하셔야 합니다. 그곳에서 산재 보상과 관련된 절차와 서비스를 안내 받으실 수 있습니다.,산업재해 보상보험 제도
근로자가 직무 중 다쳤을 때 받을 수 있는 보험은 무엇인가요?,직무 수행 중 다치거나 질병에 걸렸을 때는 산업재해 보상보험 혜택을 받을 수 있습니다. 자세한 내용은 근로복지공단에 문의하시면 안내 받으실 수 있습니다.,산업재해 보상보험 제도
사업장에서 사고가 났을 때 이를 처리해주는 정부 기관이 궁금합니다.,"사업장 내에서 발생한 사고에 대한 처리는 근로복지공단을 통해 이루어집니다. 산업재해의 신고, 보상절차 등에 관한 자세한 상담을 받으실 수 있습니다.",산업재해 보상보험 제도
"사업장이 산재보험에 가입하지 않았어도, 업무상 부상을 당했을 때 산재보상을 받을 수 있나요?","네, 당연히 산재보험이 적용되는 사업장의 경우 가입 여부와 상관없이 업무상 부상이나 질병에 대한 산재보상을 받을 수 있습니다.",산업재해 보상보험 제도
근로자가 업무 중 다쳤을 때 산재보험 처리를 위해 꼭 사업주의 동의가 필요한가요?,"아니요, 근로자는 사업주의 동의 없이도 직접 산재보험 요양급여 신청서를 작성해 관할 공단에 제출함으로써 산재신청을 할 수 있습니다.",산업재해 보상보험 제도
"만약 업무상 다친 후 사업주가 산재보험 신청에 부정적일 경우, 근로자는 어떻게 해야 하나요?",근로자는 사업주의 동의 없이도 관할 공단에 요양급여 신청서를 접수하여 산재보상을 받을 수 있는 권리가 있습니다.,산업재해 보상보험 제도
"노동능력이 손상된 상태에서 사업장이 산재보험 미가입이라면, 근로자는 어떤 조치를 취해야 하나요?","근로자는 사업장의 산재보험 가입 여부와 관계없이, 해당 사업장이 산재보험 적용 대상이라면 요양급여 신청서를 작성해 산업재해 보상을 신청할 수 있습니다.",산업재해 보상보험 제도
"업무 중 부상을 당했고, 치유 후에도 노동능력에 문제가 생겼어요. 사업주가 산재보험 신청을 돕지 않을 경우 어떻게 해야 합니까?","사업주의 도움을 받지 못하더라도, 근로자는 직접 요양급여 신청서를 준비하여 소속 사업장을 관할하는 공단에 신청함으로써 산재보상 절차를 밟을 수 있습니다.",산업재해 보상보험 제도
산업재해를 입은 근로자가 자신의 정당한 산재보상을 위해 취해야 할 행동은 무엇인가요?,"근로자는 자신의 부상이나 질병에 대한 정당한 산재보상을 받기 위해 관할 공단에 요양급여 신청서를 제출함으로써, 사업주의 동의 없이도 산재신청 절차를 진행할 수 있습니다.",산업재해 보상보험 제도
근로복지공단에 전화하고 싶어요. 어떻게 연락할 수 있나요?,근로복지공단에 연락하려면 1588-0075로 전화하시면 됩니다.,산업재해 보상보험 제도
근로복지공단 홈페이지 주소를 알려주세요.,근로복지공단의 공식 웹사이트 주소는 www.comwel.or.kr 입니다.,산업재해 보상보험 제도
산재보험 관련 정보를 웹에서 찾고 싶어요. 어디서 볼 수 있죠?,산업재해 보상보험에 대한 정보를 찾으시려면 근로복지공단 홈페이지인 www.comwel.or.kr 를 방문하시면 됩니다.,산업재해 보상보험 제도
산업재해를 당한 근로자가 받을 수 있는 정신적 지원 프로그램은 무엇인가요?,산업재해를 당하여 심리적인 어려움을 겪고 있는 근로자는 '산재근로자 사회심리 재활 지원' 프로그램을 받을 수 있습니다. 이 프로그램은 그들의 심리적 안정과 사회적 적응을 돕기 위해 마련되었습니다.,산재근로자 사회심리 재활 지원
산재 후 스트레스를 겪는 직장인들을 위한 주요 복지 서비스에는 어떤 것들이 있나요?,산재 후 스트레스에 직면한 직장인들을 위한 복지 서비스 중 하나로 '산재근로자 사회심리 재활 지원' 서비스가 있습니다. 이 서비스는 심리적 안정감 회복과 함께 사회복귀를 위한 다양한 프로그램을 제공합니다.,산재근로자 사회심리 재활 지원
작업 중 부상으로 인해 힘들어하는 제 친구에게 추천해줄 수 있는 복지 제도는 무엇인가요?,"작업 중 부상을 당해 심리적인 어려움을 겪고 있을 경우, 친구분께 '산재근로자 사회심리 재활 지원' 복지 제도를 추천해드릴 수 있습니다. 해당 제도는 부상 이후 겪게 되는 여러 심리적 문제들을 지원하고 극복하는 데 도움을 줄 것입니다.",산재근로자 사회심리 재활 지원
"산업재해를 당한 직장인인데, 심리적으로 많이 힘들어요. 도움받을 수 있는 프로그램이 있나요?",산재근로자를 위한 사회심리 재활 지원 프로그램에는 심리상담 서비스가 있습니다. 전문 상담사와의 상담을 통해 심리적 불안과 스트레스를 관리하고 극복하는 데 도움을 받을 수 있습니다.,산재근로자 사회심리 재활 지원
제 친구가 산업재해를 경험한 후 사회생활에 적응하는 데 어려움을 겪고 있어요. 어떻게 해야 하나요?,그러한 상황에는 사회적응 프로그램이 도움이 될 수 있습니다. 산재근로자를 위한 재활 프로그램에 참여하여 사회로의 복귀 준비를 지원받을 수 있습니다.,산재근로자 사회심리 재활 지원
"산업재해로 신체활동에 제한이 생겼는데, 이를 극복할 수 있는 활동이 있을까요?",재활스포츠 프로그램을 이용하실 수 있습니다. 신체활동에 제한이 있는 산재근로자들을 위해 맞춤형 운동 프로그램을 제공하여 신체 기능을 회복하고 건강을 증진시키는 데 도움을 줍니다.,산재근로자 사회심리 재활 지원
산업재해를 겪은 후 긍정적인 마음가짐을 되찾고 싶어요. 어떤 도움을 받을 수 있나요?,산재근로자를 위한 '희망찾기 프로그램'이 있습니다. 이 프로그램은 긍정적인 마인드셋을 재구성하고 새로운 삶의 목표를 설정하는 데 도움을 주는 서비스입니다.,산재근로자 사회심리 재활 지원
"동료가 작업 중 다쳐서 사회생활에 어려움을 겪고 있는데, 정서적 지지를 받을 수 있는 방법이 있나요?",산재근로자를 위해 제공되는 멘토링 프로그램을 이용해보세요. 경험있는 멘토가 노하우를 전수하며 정서적 지지를 제공하여 회복 과정에서 큰 도움이 됩니다.,산재근로자 사회심리 재활 지원
"사고 이후 계속 운동을 못 했는데, 산재근로자에게 제공되는 운동 프로그램은 어떤 혜택이 있나요?",산재근로자에게 제공되는 재활스포츠 프로그램을 통해 개인의 신체 상태에 맞는 운동 계획을 세워 체계적인 훈련과 지도를 받으며 건강을 회복할 수 있습니다.,산재근로자 사회심리 재활 지원
"산재로 인한 심리적 어려움을 겪고 있는데, 어디서 도움을 받을 수 있나요?","산재근로자의 경우 사회심리 재활 지원을 위해 근로복지공단을 통해 도움을 받으실 수 있습니다. 방문, 인터넷, 우편으로 신청이 가능합니다.",산재근로자 사회심리 재활 지원
근로복지공단에 제공하는 사회심리 재활 지원은 어떻게 신청하나요?,"근로복지공단에 제공하는 사회심리 재활 지원은 직접 방문하거나, 인터넷을 통한 온라인 신청, 또는 우편으로 신청할 수 있습니다. 어떤 방법을 택하시든 필요한 서류를 준비하여 신청하실 수 있습니다.",산재근로자 사회심리 재활 지원
"산업재해를 겪은 후 정신적으로 힘든데, 근로복지공단에서 지원은 어떻게 받을 수 있죠?","근로복지공단에서는 산업재해로 심리적 어려움을 겪고 계신 근로자를 위해 사회심리 재활 지원 서비스를 제공하고 있습니다. 이 서비스는 공단의 지사를 방문하시거나, 웹사이트에서 온라인으로, 혹은 우편으로 신청하실 수 있습니다.",산재근로자 사회심리 재활 지원
산재를 당한 후 정신적으로 힘든데 어디에서 도움을 받을 수 있나요?,산재를 당하셨다면 근로복지공단에서 제공하는 사회심리 재활 지원 프로그램에 참여하실 수 있습니다. 이 프로그램은 산재 후 정신적인 부담을 줄이고 정상적인 사회생활 복귀를 돕기 위해 만들어졌습니다.,산재근로자 사회심리 재활 지원
"내 친구가 작업 중 다쳐서 우울증세를 보이는데, 어떻게 지원받을 수 있는지 알려주세요.",작업 중 부상으로 우울증세가 있다면 근로복지공단의 산재근로자 사회심리 재활 지원 서비스를 이용하게 도와드릴 수 있습니다. 근로복지공단에 문의하여 필요한 지원 프로그램에 대한 정보를 얻으실 수 있습니다.,산재근로자 사회심리 재활 지원
사업장에서 다쳐 심리적으로 많이 힘든데 어디에 연락해야 하나요?,"먼저, 힘든 상황에 처하셨다니 매우 안타까운 일입니다. 귀하께서는 근로복지공단에 연락하셔서 산재근로자를 위한 사회심리 재활 지원 서비스를 받을 수 있습니다. 적절한 상담과 지원을 통해 심리적 회복을 돕는 프로그램이 마련되어 있습니다.",산재근로자 사회심리 재활 지원
산업재해 발생 시 연락할 근로복지공단의 전화 번호를 알고 싶어요.,산업재해 발생 시 근로복지공단에 연락하시려면 1588-0075로 전화하시면 됩니다.,산재근로자 사회심리 재활 지원
근로복지공단 홈페이지 주소를 정확히 알려주세요.,근로복지공단의 공식 홈페이지 주소는 www.comwel.or.kr 입니다.,산재근로자 사회심리 재활 지원
산재보험에 관련된 문의를 하려면 어디로 연락해야 하나요?,산재보험 관련 문의는 근로복지공단의 컨택 센터인 1588-0075번으로 하실 수 있습니다.,산재근로자 사회심리 재활 지원
산재근로자 생활안정자금 융자 대상이 되기 위한 월평균소득 상한은 얼마인가요?,"월평균소득 상한은 3인가구 중위소득 기준으로 2023년에는 443만 4,816원 이하여야 합니다.",산재근로자 생활안정자금 융자
상병보상연금을 받고 있는 산재근로자도 생활안정자금 융자를 신청할 수 있나요?,"네, 상병보상연금 수급자는 산재근로자 생활안정자금 융자 대상에 포함됩니다.",산재근로자 생활안정자금 융자
장해등급 판정을 받은 산재근로자 중 누가 융자 신청이 가능한가요?,장해등급이 제1급 이상 제9급 이하로 판정받은 산재근로자가 융자 신청이 가능합니다.,산재근로자 생활안정자금 융자
유족급여를 받는 이들도 생활안정자금 융자 대상에 포함되나요?,맞습니다. 유족급여 수급권자도 융자 대상에 속합니다.,산재근로자 생활안정자금 융자
오랫동안 요양 중인 이황화탄소질병판정자가 융자를 신청할 수 있는 기간은 어떻게 되나요?,이황화탄소(CS2) 질병판정자 중 5년 이상 요양 중인 경우 융자 신청이 가능합니다.,산재근로자 생활안정자금 융자
최저임금 이하의 평균임금을 받는 산재근로자가 융자를 받으려면 몇 개월 이상 요양해야 하나요?,최저임금 이하의 평균임금을 받는 산재근로자가 융자를 받으려면 3개월 이상 요양 중이어야 합니다.,산재근로자 생활안정자금 융자
산재로 인해 생활에 어려움을 겪는 근로자가 치료비 목적으로 대출받을 수 있는 최대 금액은 얼마인가요?,"의료비 목적으로 최대 1,000만 원까지 융자받을 수 있습니다.",산재근로자 생활안정자금 융자
"제가 결혼을 앞두고 있는데, 혹시 결혼자금을 대출받으려면 어디에 문의해야 하나요?","혼례비 융자가 가능하며, 한도는 최대 1,000만 원 이내입니다.",산재근로자 생활안정자금 융자
"사랑하는 가족이 사고로 돌아가셨는데, 장례비 지원을 받을 수 있는 방법이 있나요?","장례비 융자액은 최대 1,000만 원 이내로 지급받을 수 있습니다.",산재근로자 생활안정자금 융자
취직 준비에 필요한 비용도 융자를 통해 지원받을 수 있나요?,"취업안정자금 융자액이 있으며, 최대 1,000만 원 이내로 제공됩니다.",산재근로자 생활안정자금 융자
직장을 옮기면서 생기는 주택 이전 비용도 융자 받을 수 있나요?,"주택이전 융자가 가능하며, 융자액은 최대 1,500만 원 이내입니다.",산재근로자 생활안정자금 융자
"현재 사용하는 차량이 고장 나서 새 차를 구입하려고 하는데, 차량 구입 비용으로 융자를 받을 수 있나요?","차량구입 융자액은 최대 1,500만 원까지 지원됩니다.",산재근로자 생활안정자금 융자
대출금을 상환하는 데 있어서 선택할 수 있는 상환 방법에는 어떤 것들이 있나요?,"대출금 상환 방법으로는 '1년 거치 후 4년간', '2년 거치 후 3년간', '3년 거치 후 2년간'의 원금균등분할상환 방식 중 하나를 선택할 수 있습니다.",산재근로자 생활안정자금 융자
원금균등분할상환 방식을 선택할 때 거치기간에 따른 옵션이 궁금합니다.,"원금균등분할상환 방식을 선택 시, 거치기간에 따라 '1년 거치 후 월별로 4년 상환', '2년 거치 후 월별로 3년 상환', '3년 거치 후 월별로 2년 상환'으로 나뉘어 선택이 가능합니다.",산재근로자 생활안정자금 융자
"만약 대출을 받았을 경우, 거치기간이 포함된 상환 옵션이 존재하나요?","네, 대출 상환 옵션으로는 거치기간이 포함된 여러 방식이 있는데, '1년 동안 거치 후 4년간 상환', '2년 동안 거치 후 3년간 상환', 그리고 '3년 동안 거치 후 2년간 상환'이 그에 해당합니다.",산재근로자 생활안정자금 융자
산재근로자 생활안정자금 융자 신청은 어디서 할 수 있나요?,산재근로자 생활안정자금 융자 신청은 주소지나 요양 중인 기관이 속한 각 지역본부 지사를 방문하여 하거나 근로복지서비스의 공식 웹사이트에서 온라인으로 신청하실 수 있습니다.,산재근로자 생활안정자금 융자
온라인으로 산재근로자 생활안정자금 융자를 신청하려면 어떤 웹사이트를 이용해야 하나요?,산재근로자 생활안정자금 융자를 온라인으로 신청하기 위해서는 근로복지서비스의 누리집(웹사이트)를 이용하시면 됩니다.,산재근로자 생활안정자금 융자
산재로 인해 휴직 중인데 생활안정자금 융자를 받으려면 어느 기관을 방문해야 하나요?,"요양 중이신 경우, 본인의 주소지 또는 요양기관 관할 지역에 있는 근로복지공단 지역본부 또는 지사에 방문하여 산재근로자 생활안정자금 융자 신청을 하실 수 있습니다.",산재근로자 생활안정자금 융자
산재를 당한 직원이 생활비를 지원받을 수 있는 방법이 있나요?,"네, 산재근로자는 근로복지공단을 통해 생활안정자금 융자를 신청할 수 있습니다. 근로복지서비스 누리집에서 자세한 안내와 신청 절차를 확인하실 수 있습니다.",산재근로자 생활안정자금 융자
사고로 인해 일을 못 하게 된 근로자가 금전적인 도움을 받을 수 있는 국가 서비스는 어떤 것이 있나요?,"산업재해로 인해 외벌이 가정의 수입원이 작업을 할 수 없게 되었다면, 근로복지공단에서 제공하는 산재근로자 생활안정자금 융자를 활용할 수 있습니다. 이는 일시적으로 수입이 줄어든 근로자들의 생활 안정을 돕기 위한 제도입니다.",산재근로자 생활안정자금 융자
직장에서 다친 후 생계유지가 어려워진 경우 지원받을 수 있는 복지 혜택이 있을까요?,사업장에서 발생한 사고로 생계가 곤란해진 근로자에게는 근로복지공단을 통한 산재근로자 생활안정자금 융자가 지원됩니다. 해당 서비스에 대한 상세 정보와 이용 방법은 근로복지서비스 누리집에서 찾아보시길 권장 드립니다.,산재근로자 생활안정자금 융자
산재근로자를 위한 신용보증지원이 제공되는 사업의 이름은 무엇인가요?,산재근로자를 위한 신용보증지원이 제공되는 사업의 이름은 '산재근로자 생활안정자금 융자사업'입니다.,산재근로자 생활안정자금 융자
산재근로자 생활안정자금 융자사업의 신용보증 대상에서 제외되는 사람은 어떤 유형이 있나요?,"신용보증 대상에서 제외되는 유형은 한국신용정보원에 부정적인 신용정보가 등록된 사람, 외국인과 재외동포, 공단으로부터 신용보증을 받고 구상금을 미납한 사람, 부정대부 신청 또는 대부결정 취소 사실이 있는 사람입니다.",산재근로자 생활안정자금 융자
융자사업 신청 시 고려해야 할 신용정보 조건은 무엇인가요?,융자사업 신청 시 고려해야 할 신용정보 조건은 한국신용정보원에 등록된 신용도판단정보 또는 공공정보가 부정적이지 않아야 합니다.,산재근로자 생활안정자금 융자
과거에 신용보증지원을 받았다면 융자사업 신청 가능성에 어떤 영향을 미치나요?,과거 신용보증지원을 받았더라도 구상금을 정상적으로 납부하였거나 부정대부 등으로 대부결정이 취소된 이력이 없어야 신청 가능성에 문제가 없습니다.,산재근로자 생활안정자금 융자
산재근로자 생활안정자금 융자사업 신청 제외 대상에 해당하는 외국인은 어떤 경우에 해당하나요?,신용보증지원 대상에서 제외되는 외국인은 한국신용정보원에 부정적인 신용정보가 등록된 경우에 해당합니다.,산재근로자 생활안정자금 융자
제가 외국인인데 산재근로자 생활안정자금 융자사업 신청이 가능한지 궁금합니다. 어떤 조건을 충족해야 하나요?,"외국인도 산재근로자 생활안정자금 융자사업 신청이 가능하며, 한국신용정보원에 등록된 부정적인 신용정보가 없고 공단으로부터의 신용보증지원에 대한 부정적인 기록이 없어야 합니다.",산재근로자 생활안정자금 융자
근로복지공단의 공식 홈페이지 주소를 알려주세요.,근로복지공단의 공식 홈페이지 주소는 welfare.comwel.or.kr 입니다.,산재근로자 생활안정자금 융자
근로복지공단에 문의하고 싶어요. 어떤 번호로 전화해야 하나요?,근로복지공단에 문의하려면 1588-0075 번호로 전화하시면 됩니다.,산재근로자 생활안정자금 융자
"산업재해 관련해서 도움이 필요한데, 어디로 연락해야 하나요?",산업재해와 관련된 도움이 필요하시다면 근로복지공단에 1588-0075 로 연락하여 상담 받으실 수 있습니다.,산재근로자 생활안정자금 융자
산재를 당한 근로자가 직업훈련을 받으려면 현재 무슨 상태여야 하나요?,"산재근로자 직업훈련을 받으려면 신청일 현재 자영업자를 포함한 미취업 상태여야 하며, 다른 직업 훈련 프로그램에 참여하고 있지 않아야 합니다.",산재근로자 직업훈련
"제가 산업재해를 입고 지금은 일을 하지 않는데, 산재근로자 직업훈련을 신청할 수 있을까요?","네, 현재 미취업 상태라면 산재 장해등급이 제1급에서 제12급 사이에 해당되는 경우 직업훈련 신청이 가능합니다.",산재근로자 직업훈련
현재 자영업을 하고 있지는 않지만 다른 직업훈련 프로그램을 수강 중인 산재 장해인입니다. 제가 직업훈련에 참여할 수 있을까요?,"아니요, 현재 다른 직업훈련 프로그램에 참여 중인 경우에는 산재근로자 직업훈련 프로그램에 참여할 수 없습니다.",산재근로자 직업훈련
산재로 인해 어느 정도의 장해등급을 받으면 직업훈련을 신청할 수 있나요?,산재 장해등급이 제1급에서 제12급사이에 해당되는 경우에 직업훈련을 신청할 수 있습니다.,산재근로자 직업훈련
"지금 현재 직업을 갖고 있지 않고, 산재로 인한 장해등급도 받았습니다. 어떤 절차를 통해 직업훈련을 신청해야 하나요?","미취업 상태이며 적절한 산재 장해등급을 받았다면, 필요한 서류를 준비하여 산재근로자 직업훈련 프로그램에 신청하실 수 있습니다. 구체적인 신청 절차는 관련 기관에 문의하여 확인해주세요.",산재근로자 직업훈련
"산재 장해인의 경우, 어떤 상황에서 직업훈련의 혜택을 받을 수 없나요?","산재 장해인이 현재 다른 직업훈련에 참여하고 있거나, 장해등급이 제1급 미만 또는 제12급을 초과하는 경우 직업훈련 혜택을 받을 수 없습니다.",산재근로자 직업훈련
산업재해를 당한 근로자가 직업능력개발훈련을 받기 위해 신청할 때 정부로부터 어떤 지원을 받을 수 있나요?,"산재근로자가 직업능력개발훈련을 신청하면, 정부지원승인 훈련비를 받을 수 있습니다. 또한 개인별로 최대 600만 원 한도 내에서 직업훈련비용도 지급됩니다.",산재근로자 직업훈련
직업훈련 수강 중인 산재근로자에게 제공되는 직업훈련수당은 어떻게 계산되나요?,"직업훈련수당은 최저임금액을 기준으로 하여, 훈련 시간과 기간에 따라 차등 지급됩니다.",산재근로자 직업훈련
"재취업 준비를 위해 한국장애인고용공단의 위탁훈련을 받으려는데, 이 비용은 어떻게 지원받을 수 있나요?",한국장애인고용공단의 위탁훈련을 받으려면 정부지원승인 훈련비에 대한 지원을 받을 수 있습니다.,산재근로자 직업훈련
"산재근로자가 개별적으로 훈련 기관을 선택하는 경우, 직업훈련비용에 대한 정부 지원은 어떻게 이루어지나요?","개별적으로 선택한 훈련의 경우, 산재근로자 개인별로 600만 원 한도 내에서 직업훈련비용을 지원받을 수 있습니다.",산재근로자 직업훈련
"산재근로자가 재취업을 위한 직업훈련 신청 시, 훈련수당은 하루 기준으로 얼마인가요?",재취업을 위한 직업훈련 수당은 하루 최저임금을 기준으로 정해진 훈련 시간과 기간에 따라 차등 지급됩니다.,산재근로자 직업훈련
"산재를 입은 이후 직업훈련을 받아야 하는데, 어느 법에 따라 직업능력개발훈련이 정해지나요?",근로자직업능력개발법에 따라 산재근로자를 위한 직업능력개발훈련이 정해집니다. 이를 통해 적절한 훈련과 지원을 받을 수 있습니다.,산재근로자 직업훈련
산업재해를 겪은 근로자가 직업훈련을 받으려면 어떤 절차를 거쳐야 하나요?,산재근로자가 직업훈련을 받기 위해서는 가까운 근로복지공단 지사나 지역본부를 방문하거나 우편을 통해 신청하면 됩니다.,산재근로자 직업훈련
