Question,Answer,Documents
취업성공 후 국민취업지원제도 내에서 지급되는 '취업성공수당'의 근속 요건과 지원금액은 어떻게 되나요?,"'취업성공수당'은 6개월 근속 시 50만 원을 지원받으며, 12개월 근속하면 100만 원을 지원받을 수 있습니다. 단, 소득기준이 중위소득 60% 이하이거나 특정계층에 해당하는 참여자는 소득에 무관하게 지원받습니다.",국민취업지원제도
국민취업지원제도 Ⅱ유형에서 제공하는 '훈련참여지원수당'을 받으려면 어떤 조건을 충족해야 하나요?,"Ⅱ유형의 '훈련참여지원수당'을 받기 위해서는 직업훈련에 참여하며 훈련 기간 동안 최소 80% 이상 출석해야 하며, 이 경우 월 28.4만 원을 최대 6개월 동안 지원받을 수 있습니다.",국민취업지원제도
국민취업지원제도에 참여하고 싶어요. 어떻게 신청할 수 있나요?,"국민취업지원제도에 참여하시려면 거주지의 관할 고용센터를 방문하거나, 온라인으로 신청하실 수 있습니다.",국민취업지원제도
국민취업지원제도 온라인으로 신청하려면 어디로 가야 하나요?,국민취업지원제도의 온라인 신청은 http://www.kua.go.kr 웹사이트를 통해 가능합니다.,국민취업지원제도
집 근처에 있는 고용센터를 직접 가지 않고도 취업 지원을 받을 수 있는 방법이 있나요?,"네, 국민취업지원제도 홈페이지를 이용하시면 온라인으로 직접 참여 신청을 하실 수 있습니다.",국민취업지원제도
"현재 실업 상태인데, 국민취업지원제도 정보를 어디서 얻을 수 있을까요?",국민취업지원제도에 대한 정보는 http://www.kua.go.kr 웹사이트에서 상세히 확인하실 수 있습니다.,국민취업지원제도
취업준비를 도와주는 정부 프로그램을 이용하고 싶어요. 신청 절차가 궁금합니다.,취업준비를 위한 국민취업지원제도 신청은 가까운 고용센터 또는 공식 온라인 사이트를 통해 하실 수 있습니다.,국민취업지원제도
온라인으로 국민취업지원제도에 어떻게 참여할 수 있나요?,온라인 참여를 원하신다면 국민취업지원제도의 공식 웹페이지인 http://www.kua.go.kr 에서 신청 절차를 진행하실 수 있습니다.,국민취업지원제도
취업을 준비하고 있는데 국민취업지원제도에 대해 알아보려면 어디로 연락해야 하나요?,국민취업지원제도에 대한 문의는 고용노동부 고객상담센터에 전화하시면 됩니다. 연락하실 번호는 1350입니다.,국민취업지원제도
"국민취업지원제도 신청과 관련된 도움을 받고 싶은데, 고용노동부에 어떻게 문의해야 하죠?",고용노동부 고객상담센터로 전화하셔서 국민취업지원제도와 관련된 지원을 받으실 수 있습니다. 상담센터의 번호는 1350입니다.,국민취업지원제도
제가 국민취업지원제도 자격요건에 부합하는지 확인하고 싶어요. 어디로 연결해야 도움을 받을 수 있나요?,자격여부 확인을 위해서는 고용노동부 고객상담센터로 문의하시면 됩니다. 상담센터의 전화번호는 1350입니다.,국민취업지원제도
근로장려금을 신청할 때 중요한 가족 구성원에는 어떤 사람들이 포함되나요?,"근로장려금 신청 시 중요한 가족 구성원으로는 배우자, 18세 미만의 부양자녀, 그리고 만 70세 이상의 직계존속이 포함됩니다.",근로장려금
"2022년 기준, 단독가구가 근로장려금 대상이 되기 위한 총소득 기준은 어느 정도인가요?",단독가구가 근로장려금 대상이 되려면 2022년 총소득 기준금액이 2200만 원 미만이어야 합니다.,근로장려금
"근로장려금 대상 중, 홑벌이 가구는 어떤 조건을 충족해야 하며, 최대 얼마까지 지급받을 수 있나요?","홑벌이 가구가 되기 위해서는 18세 미만 부양자녀 또는 부양 직계존속이 있어야 하며, 배우자의 총급여액이 300만 원 미만이어야 합니다. 홑벌이 가구의 근로장려금 최대지급액은 285만 원입니다.",근로장려금
2022년 6월 1일 기준으로 근로장려금의 재산요건은 어떻게 되나요?,근로장려금을 받기 위한 재산요건은 2022년 6월 1일 기준 재산 합계액이 2억 4000만 원 미만이어야 합니다.,근로장려금
맞벌이 가구가 근로장려금을 받기 위한 소득과 재산의 조건에는 어떤 것들이 있나요?,"맞벌이 가구가 근로장려금 대상이 되기 위해선 신청인과 배우자 각각의 총급여액이 300만 원 이상이어야 하며, 총소득 기준금액은 3800만 원 미만, 또한 2022년 6월 1일 기준 재산의 합계액이 2억 4000만 원 미만이어야 합니다.",근로장려금
재산이 1억 7000만 원 이상 2억 4000만 원 미만인 경우 근로장려금은 어떻게 지급되나요?,"재산 합계액이 1억 7000만 원 이상 2억 4000만 원 미만인 경우, 근로장려금은 정상 지급액의 50%로 지급됩니다.",근로장려금
근로장려금이란 무엇인가요?,"근로장려금은 소득이 낮은 근로자, 사업자, 종교인 가구에 지급되는 정부 지원금으로, 일하는 의욕을 높이고, 가구의 실질소득을 보충하기 위해 마련된 제도입니다.",근로장려금
근로장려금을 받을 조건은 무엇인가요?,"근로장려금 수급 조건에는 일정 소득 이하의 근로자, 사업자, 종교인이 해당되며, 타의적인 요건들(가구 구성, 재산 한도 등)을 충족해야 합니다.",근로장려금
근로장려금 신청 방법에 대해 알려주세요.,"근로장려금 신청은 국세청 홈택스 웹사이트 또는 스마트폰 앱을 통해 연 2회 신청 기간에 할 수 있으며, 필요한 서류를 준비하여 온라인 또는 방문 신청할 수 있습니다.",근로장려금
근로장려금 지급 일정은 어떻게 되나요?,"근로장려금은 주로 연 2회 신청기간이 지난 후 심사를 거쳐, 대략적으로 상반기와 하반기에 지급 일정이 결정되어 수급자에게 지급됩니다.",근로장려금
근로장려금 수급 후 사용에 제한이 있나요?,"근로장려금은 수급자의 생활 지원을 목적으로 하므로, 지급받은 금액의 사용에 특별한 제한은 없으며, 생활비, 교육비 등으로 자유롭게 사용할 수 있습니다.",근로장려금
근로장려금과 비슷한 다른 복지제도도 있나요?,"네, 근로장려금과 유사한 목적을 가진 자녀장려금이라는 제도가 있으며, 이는 자녀 양육을 돕는 가구에 추가적인 경제적 지원을 제공하는 제도입니다.",근로장려금
매년 근로장려금 신청은 언제 해야 하나요?,"근로장려금은 매년 5월에 신청해야 하며, 기한 후 신청 시에는 감액 지급됩니다.",근로장려금
근로장려금을 10% 감액 없이 전액 받으려면 언제까지 신청해야 하나요?,근로장려금 전액을 받기 위해서는 기한 내인 5월까지 신청해야 합니다.,근로장려금
직접 방문하지 않고 근로장려금을 신청할 수 있는 방법은 무엇인가요?,"ARS 전화 1544-9944를 이용하거나, 홈택스 PC 또는 모바일 앱을 통해 전자신청이 가능합니다.",근로장려금
근로장려금 상반기 소득분 신청 기간은 언제인가요?,상반기 소득분 근로장려금 신청 기간은 9월 1일부터 9월 15일까지입니다.,근로장려금
근로장려금 신청대리 서비스 이용이 가능한 대상은 무엇인가요?,근로장려금 신청대리 서비스는 고령자나 장애인 등 전자신청이 어려운 안내대상자가 이용할 수 있습니다.,근로장려금
반기별로 근로장려금을 신청하려면 어떻게 해야 하는지 알려주세요.,"근로소득자는 당해연도 반기별 지급을 선택하여 상반기 소득분은 9월, 하반기 소득분은 다음 해 3월에 각각 신청할 수 있습니다.",근로장려금
근로장려금 신청방법을 알려줄 수 있나요?,"근로장려금에 대한 신청 방법은 국세청 홈택스 웹사이트에서 안내하고 있으며, 궁금한 점이 있으시면 국세상담센터 126번으로 문의하실 수 있습니다.",근로장려금
내년도 근로장려금 지급일은 언제인가요?,"근로장려금 지급일은 매년 달라질 수 있으며, 정확한 일정은 국세청 홈택스 또는 국세상담센터 126번으로 문의하시면 안내받으실 수 있습니다.",근로장려금
근로장려금 수령을 위한 자격 요건이 궁금합니다.,"근로장려금 수령 자격 요건에 대한 정보는 국세청 홈택스를 통해 확인하실 수 있고, 추가적인 문의는 국세상담센터 126번을 통해 상담받으실 수 있습니다.",근로장려금
만약 학교를 다니지 않는 16세 청소년이 학업을 계속하고 싶어한다면 어떤 기관을 추천할 수 있나요?,학업을 이어가고자 하는 16세 학교 밖 청소년에게 내일이룸학교를 추천할 수 있습니다. 이곳은 15세 이상 24세 이하의 청소년들을 대상으로 학교생활과 유사한 경험을 제공하며 자기 주도적 학습을 돕습니다.,내일이룸학교
"학교 밖 청소년이지만 고등학교 졸업학력을 인정받고 싶은 19세 청년이 있다면, 어떤 곳에서 이를 지원받을 수 있을까요?",만 19세 청년이라면 내일이룸학교에서 고등학교 졸업학력 인정과 함께 자기 주도적 교육 과정을 이수할 기회를 얻을 수 있습니다. 이 프로그램은 학교 밖 청소년이 정규 교육 과정을 이어갈 수 있도록 설계되었죠.,내일이룸학교
"저는 스무 살이고 정규 교육 외에 다양한 직업 훈련을 받고 싶은데, 제 나이에 맞는 교육 프로그램이 있을까요?",스무 살인 청년을 위해 내일이룸학교에서는 정규 교육과 더불어 직업 훈련과 같은 다양한 비교육적 프로그램을 제공합니다. 여러분의 나이와 상황에 맞춘 맞춤형 교육을 통해서 미래의 직업 경로를 탐색할 수 있습니다.,내일이룸학교
학교 밖 청소년이 내일이룸학교에서 받을 수 있는 직업훈련에 대해 알려주세요.,내일이룸학교는 전문직업훈련 프로그램을 학교 밖 청소년에게 제공하여 경제적 자립을 돕고 있습니다.,내일이룸학교
내일이룸학교에 기숙사가 있는지 궁금합니다. 제공 조건은 어떻게 되나요?,"훈련기관에 따라 다르지만, 내일이룸학교는 해당하는 경우 무료기숙사를 제공합니다.",내일이룸학교
기숙사가 없는 내일이룸학교 훈련생들에게는 어떤 지원이 제공되나요?,"기숙사를 제공하지 않는 경우, 내일이룸학교는 훈련생에게 교통비 및 중식비를 월 최대 16만 원까지 지원합니다.",내일이룸학교
내일이룸학교에서 훈련생들이 받을 수 있는 자립장려금에 대해 설명해주세요.,훈련생 1인당 월 최대 30만 원의 자립장려금을 내일이룸학교에서 지원하고 있습니다.,내일이룸학교
내일이룸학교가 학력취득 지원을 어떻게 해주는지 궁금합니다.,"학교는 검정고시 준비 지원을 비롯하여 예체능 활동, 심리상담 등을 통해 훈련생의 학력취득 및 특기적성 개발을 돕고 있습니다.",내일이룸학교
내일이룸학교 훈련생이 예체능 활동이나 개인 상담 등을 받고 싶어요. 어떤 프로그램이 있나요?,내일이룸학교에서는 훈련생이 자신의 특기와 적성을 개발할 수 있도록 예체능 활동 지원과 심리상담 서비스를 포함한 다양한 프로그램을 제공합니다.,내일이룸학교
내일이룸학교 신청하려면 어떻게 해야 하나요?,"한국생산성본부 또는 꿈드림센터에 연락하여 유선으로 신청하거나, 정부24 홈페이지(www.gov.kr)를 통해 온라인으로 신청할 수 있습니다.",내일이룸학교
정부24에서 내일이룸학교 신청하는 방법을 알려줄 수 있나요?,정부24 웹사이트(http://www.gov.kr)에 접속하여 내일이룸학교 신청 관련 정보를 검색한 후 제공되는 온라인 신청 절차를 따르시면 됩니다.,내일이룸학교
학교밖청소년지원센터를 통해 내일이룸학교를 어떻게 신청하나요?,꿈드림센터로 전화하셔서 내일이룸학교 지원에 필요한 정보를 문의하고 유선 신청 절차를 안내받으시면 됩니다.,내일이룸학교
내일이룸학교에 지원하고 싶어요. 연락해야 하는 기관은 어디인가요?,"내일이룸학교 지원을 위해서는 한국생산성본부나 꿈드림센터에 연락하여 안내를 받으실 수 있으며, 추가적으로 정부24 사이트를 통한 온라인 지원도 가능합니다.",내일이룸학교
내일이룸학교 온라인 신청을 하고 싶어요. 어디로 가야 하나요?,온라인으로 내일이룸학교를 신청하시려면 정부24 홈페이지(http://www.gov.kr)에 접속하여 지원 과정을 진행하시면 됩니다.,내일이룸학교
꿈드림센터에서는 내일이룸학교 신청을 어떤 방식으로 할 수 있나요?,꿈드림센터를 통해 내일이룸학교에 신청하시려면 전화로 문의하신 후 유선상의 안내에 따라 신청 절차를 진행하면 됩니다.,내일이룸학교
내일이룸학교에 대한 상세 정보를 알고 싶어요. 어디로 문의해야 하나요?,내일이룸학교에 대한 상세 정보가 필요하시면 한국생산성본부에 유선으로 문의하실 수 있습니다. 전화번호는 02-398-7640입니다. 또는 꿈드림센터에 방문하여 안내를 받으실 수 있습니다. 둘 중 편한 방법을 선택하세요.,내일이룸학교
"당장 내일이룸학교에 관한 질문을 온라인으로 해야 하는데, 어떻게 하면 될까요?",내일이룸학교에 대한 온라인 문의는 정부24 웹사이트에 접속하여 진행하실 수 있습니다. 웹 주소는 http://www.gov.kr 입니다. 이 사이트를 통해 필요한 정보를 얻거나 문의하실 수 있어요.,내일이룸학교
내일이룸학교의 전화상담은 어디로 연락해야 하나요?,"내일이룸학교에 대한 전화상담은 한국생산성본부로 문의하시면 됩니다. 전화번호는 02-398-7640로 연락하시면 되며, 친절한 상담을 받으실 수 있습니다.",내일이룸학교
내일이룸학교와 관련된 정보를 웹사이트로 찾고 싶어요. 접속해야 하는 웹사이트 주소가 뭐예요?,내일이룸학교와 관련된 정보를 웹사이트를 통해 찾고 싶으시다면 한국생산성본부 웹사이트인 http://www.kpc.or.kr 또는 꿈드림센터 웹사이트인 http://www.kdream.or.kr 에 접속하시면 됩니다.,내일이룸학교
"한국생산성본부와 연락하고 싶은데, 온라인으로도 문의할 수 있나요?",한국생산성본부와의 온라인 문의를 원하신다면 한국생산성본부 공식 웹사이트인 http://www.kpc.or.kr 를 방문해 문의사항을 전달하실 수 있습니다.,내일이룸학교
꿈드림센터를 방문하기 전에 사전에 확인해보고 싶은 정보가 있어요. 어떻게 하면 될까요?,꿈드림센터를 방문하기 전 확인하고자 하는 정보가 있다면 꿈드림센터의 공식 웹사이트인 http://www.kdream.or.kr 를 통해 필요한 정보를 사전에 얻으실 수 있습니다.,내일이룸학교
서울 지역에서 스마트 크리에이터 실무 과정을 배울 수 있는 내일이룸학교는 어디인가요?,"서울 지역에서 스마트 크리에이터 실무과정을 제공하는 내일이룸학교는 한국능력개발 직업전문학교입니다. 훈련 기간은 03월 08일부터 11월 27일까지며, 모집 인원은 24명입니다.",내일이룸학교
플라워 및 플랜테리어&e-커머스 마케터 양성과정이 개설된 서울의 내일이룸학교는 어디에 있나요?,"해당 과정은 (재)서울현대 교육재단에서 제공되며, 훈련 기간은 04월 03일부터 11월 17일까지로, 16명을 모집합니다.",내일이룸학교
인천에서 호텔 식음료 전문가가 되기 위한 교육을 받을 수 있는 내일이룸학교는 어느 기관인가요?,"인천실용전문학교에서 호텔 식음료 전문가 양성과정(조주+바리스타)을 제공하고 있으며, 훈련 기간은 03월 20일부터 11월 17일까지이며, 16명의 인원을 모집합니다.",내일이룸학교
경기 지역에 위치한 내일이룸학교 중 스마트 바리스타와 파티쉐를 양성하는 곳은 어디인가요?,"경기 지역에서 스마트 바리스타& 파티쉐 전문과정을 제공하는 학교는 한주요리제과커피 직업전문학교로, 03월 13일부터 10월 18일까지 훈련 기간이며, 15명의 인원을 모집합니다.",내일이룸학교
광주 지역 내일이룸학교에서 한식조리기능사 취득과 푸드디렉터 양성과정은 어느 학교에서 진행되나요?,"(재)한국능력개발원 호남직업전문학교에서 한식조리기능사 취득 및 푸드디렉터 양성과정이 진행되며, 훈련 기간은 03월 02일부터 11월 30일까지이고, 모집 인원은 20명입니다.",내일이룸학교
부산 지역의 학교밖청소년지원센터에서 개설된 카페산업 전문인력 양성 과정의 내용과 훈련 기간은 어떻게 되나요?,"부산광역시 학교밖청소년지원센터에서 카페산업 전문인력 양성 실무과정을 제공하며, 훈련 기간은 04월 17일부터 10월 06일까지로, 인원은 18명을 모집합니다.",내일이룸학교
산업계 주도 청년 맞춤형 훈련에 참여할 수 있는 연령대는 어떻게 되나요?,참여할 수 있는 연령대는 만 18세 이상 만 34세 이하의 청년 구직자 및 재직자입니다.,산업계 주도 청년 맞춤형 훈련
채용예정자를 대상으로 한 산업계 주도 훈련에서 청년층의 참여 비율에 대한 기준은 무엇인가요?,"채용예정자 훈련의 경우, 청년층 참여가 70% 이상 의무화되어 있습니다.",산업계 주도 청년 맞춤형 훈련
현재 재직 중인 직원도 산업계 주도 청년 맞춤형 훈련에 참여할 수 있나요?,"네, 만 18세 이상 만 34세 이하의 재직자도 훈련에 참여할 수 있으며, 재직자 훈련의 경우 청년층 참여가 50% 이상이어야 합니다.",산업계 주도 청년 맞춤형 훈련
채용예정자와 재직자 훈련에 있어서 청년 참여 비율에 차이가 있나요?,"네, 채용예정자 훈련은 청년 참여가 70% 이상, 재직자 훈련은 50% 이상이어야 합니다.",산업계 주도 청년 맞춤형 훈련
"만약 채용예정자 훈련이 있다면, 이 훈련의 청년 참여 의무 비율은 얼마인가요?",채용예정자 훈련에서는 청년 참여가 70% 이상 의무화되어 있습니다.,산업계 주도 청년 맞춤형 훈련
재직자를 위한 산업계 주도 훈련에서 청년 참여 의무 비율은 얼마인가요?,"재직자를 위한 훈련의 경우, 청년 참여 의무 비율은 50% 이상이 되어야 합니다.",산업계 주도 청년 맞춤형 훈련
"산업계 주도 청년 맞춤형 훈련에 참여하고 싶은데, 별도의 카드를 발급받지 않아도 되나요?","네, 산업계 주도 청년 맞춤형 훈련생은 국민내일배움카드를 발급받지 않아도 참여할 수 있으며 이미 발급받은 사람도 계좌 잔액이 차감되지 않습니다.",산업계 주도 청년 맞춤형 훈련
청년 맞춤형 훈련 기간 동안 요구되는 최소 훈련 시간은 얼마인가요?,"청년 맞춤형 훈련 기간은 최소 1개월 이상이며, 훈련 시간은 월평균 120시간 이상 요구됩니다.",산업계 주도 청년 맞춤형 훈련
산업별 협단체는 산업계 주도 청년 맞춤형 훈련에서 어떤 비용 지원을 받을 수 있나요?,산업별 협단체는 운영비와 프로그램 개발비를 지원받을 수 있습니다.,산업계 주도 청년 맞춤형 훈련
재직자는 산업계 주도 청년 맞춤형 훈련에 어떻게 참여할 수 있나요?,재직자의 경우 최소 4시간 이상의 훈련에 참여할 수 있습니다.,산업계 주도 청년 맞춤형 훈련
공동훈련센터의 경우 산업계 주도 청년 맞춤형 훈련 인프라지원금을 통해 어떤 지원을 받나요?,공동훈련센터는 운영비와 시설 및 장비비를 지원받을 수 있습니다.,산업계 주도 청년 맞춤형 훈련
산업계 주도 청년 맞춤형 훈련 프로그램을 운영하려면 NCS 적용 비율을 어떻게 설정해야 하나요?,해당 훈련 프로그램은 산업 현장의 특화된 수요에 대응하기 위해 NCS 적용 비율을 탄력적으로 운용할 수 있습니다.,산업계 주도 청년 맞춤형 훈련
청년 맞춤 훈련 프로그램에 어떻게 지원할 수 있나요?,산업계 주도 청년 맞춤형 훈련 프로그램에 지원하려면 http://www.i-hrd.net 홈페이지를 통해 신청하실 수 있습니다.,산업계 주도 청년 맞춤형 훈련
"산업계 중심으로 청년들을 위한 훈련이 있다고 들었는데, 정보를 어디서 찾아볼 수 있죠?",해당 훈련 프로그램에 대한 정보는 산업계 주도 청년 맞춤형 훈련 전용 홈페이지인 http://www.i-hrd.net 에서 확인하실 수 있습니다.,산업계 주도 청년 맞춤형 훈련
산업 분야별로 맞춤 훈련을 받으려면 어떻게 해야 하나요?,각 산업 분야에 맞춤화된 훈련을 받기 위해서는 http://www.i-hrd.net 웹사이트를 방문하여 훈련 신청 절차를 따라하시면 됩니다.,산업계 주도 청년 맞춤형 훈련
실무 기술을 배울 수 있는 청년 훈련 프로그램 접수는 어디서 하나요?,청년 맞춤형 실무 기술 훈련 프로그램의 접수는 http://www.i-hrd.net 웹사이트에서 할 수 있습니다. 사이트 방문 후 신청 절차에 따라주세요.,산업계 주도 청년 맞춤형 훈련
"청년 직업 훈련 프로그램 참여를 원하는데, 신청 절차를 알려주세요.","청년 직업 훈련 프로그램 참여를 위한 신청 절차는 산업계 주도 청년 맞춤형 훈련 웹사이트(http://www.i-hrd.net)에서 상세히 안내하고 있으니, 해당 사이트를 방문하여 확인하실 수 있습니다.",산업계 주도 청년 맞춤형 훈련
"현장 실습을 포함한 직무 교육을 받고 싶은데, 어디로 신청하나요?",현장 실습을 포함한 직무 교육에 대한 신청은 산업계 주도 청년 맞춤형 훈련 전용 홈페이지인 http://www.i-hrd.net 에서 하실 수 있습니다. 홈페이지에서 신청 방법을 확인하세요.,산업계 주도 청년 맞춤형 훈련
청년 취업 준비를 위해 맞춤형 훈련 정보를 어디서 얻을 수 있나요?,한국산업인력공단의 산업계 주도 청년 맞춤형 훈련 프로그램 정보는 1644-8000으로 전화하거나 http://www.i-hrd.net 웹사이트를 방문하시면 얻으실 수 있습니다.,산업계 주도 청년 맞춤형 훈련
산업계 주도 훈련 프로그램에 신청하고 싶어요. 어디로 연락해야 하나요?,"산업계 주도 청년 맞춤형 훈련 프로그램 신청은 한국산업인력공단에 1644-8000로 전화하시거나, http://www.i-hrd.net 웹사이트에서 신청하실 수 있습니다.",산업계 주도 청년 맞춤형 훈련
"직업 훈련을 찾고 있는데, 산업계가 주도하는 프로그램은 뭐가 있을까요?",한국산업인력공단에서 운영하는 산업계 주도 청년 맞춤형 훈련 프로그램에 대한 정보는 전화번호 1644-8000 또는 공식 사이트 http://www.i-hrd.net 에서 확인하실 수 있습니다.,산업계 주도 청년 맞춤형 훈련
취업 성공 패키지에 포함된 산업 맞춤 훈련은 어떻게 신청하나요?,취업 성공 패키지의 일환으로 제공되는 산업 맞춤 훈련은 한국산업인력공단을 통해 신청 가능합니다. 자세한 사항은 1644-8000으로 문의하거나 http://www.i-hrd.net 사이트를 확인해 주세요.,산업계 주도 청년 맞춤형 훈련
청년 취업 지원과 관련하여 산업별 훈련과정에 대해 알아보고 싶어요. 정보는 어디서 확인할 수 있나요?,"청년 취업을 위한 산업별 맞춤 훈련 과정 정보는 한국산업인력공단에 1644-8000으로 문의하거나, 웹사이트 http://www.i-hrd.net 에서 확인 가능합니다.",산업계 주도 청년 맞춤형 훈련
특정 산업 분야에 초점을 맞춘 취업 훈련 프로그램에 참여하고자 합니다. 어떻게 신청할 수 있나요?,"특정 산업 분야별 맞춤형 취업 훈련 프로그램 신청은 한국산업인력공단의 콜센터 1644-8000으로 하실 수 있고, 이들 프로그램에 대한 자세한 정보는 http://www.i-hrd.net 웹사이트에서 확인하실 수 있습니다.",산업계 주도 청년 맞춤형 훈련
정보기술 분야에서 청년 맞춤형 훈련 사업단으로 선정된 협단체와 훈련센터의 이름은 무엇인가요?,정보기술 산업 분야의 사업단은 한국소프트웨어기술진흥협회와 한국소프트웨어기술훈련원으로 이루어져 있습니다.,산업계 주도 청년 맞춤형 훈련
