Question,Answer,Documents
여성가족부 누리집에서 볼 수 있는 내용은 무엇인가요?,여성가족부 누리집에서는 여성 경제활동의 촉진과 관련된 다양한 지원사업 및 직업교육훈련 현황을 확인하실 수 있습니다.,여성 경제활동 촉진 지원사업
여성 근로자를 위한 재취업 지원 프로그램에 대해 어디서 정보를 얻을 수 있나요?,"여성 근로자를 위한 재취업 지원 프로그램에 대한 정보는 여성새로일하기센터에서 제공하고 있으며, 문의 전화번호는 1544-1199입니다. 추가 정보를 원하시면 여성새로일하기센터 웹사이트(http://www.saeil.mogef.go.kr)를 방문하시면 됩니다.",여성 경제활동 촉진 지원사업
전업주부였던 제가 다시 일자리를 찾으려면 어디로 연락해야 하나요?,전업주부로서 다시 일자리를 찾고자 할 때는 여성새로일하기센터에 연락하시면 도움을 받으실 수 있습니다. 연락처는 1544-1199로 문의하실 수 있습니다. 또한 그들의 웹사이트(http://www.saeil.mogef.go.kr)에 방문하셔서 자세한 프로그램 내용을 확인하실 수 있습니다.,여성 경제활동 촉진 지원사업
일을 다시 시작하고자 하는 여성을 위한 지원서비스는 어디서 제공하나요?,"여성이 직업을 구하기 위해 다시 시작하려고 할 때, 여성새로일하기센터에서 다양한 지원서비스를 제공합니다. 이 서비스에 대해 자세히 알아보시려면 1544-1199로 전화하시거나 여성새로일하기센터 웹사이트(http://www.saeil.mogef.go.kr)를 방문하세요.",여성 경제활동 촉진 지원사업
여성 취업 지원 프로그램에 관해 더 알고 싶어요. 어디서 정보를 찾을 수 있을까요?,"여성 취업 지원 프로그램에 대한 정보는 여성새로일하기센터에서 제공됩니다. 상세한 정보와 문의는 1544-1199로 하실 수 있고, 그들의 웹사이트(http://www.saeil.mogef.go.kr)도 참고하실 수 있습니다.",여성 경제활동 촉진 지원사업
경력단절 여성이 경제활동에 복귀하기 위한 상담은 어디서 하나요?,"경력단절 여성이 경제활동에 복귀를 위한 상담은 여성새로일하기센터에서 받으실 수 있습니다. 상담을 원하신다면 1544-1199 전화번호로 문의하실 수 있으며, 여성새로일하기센터 웹사이트(http://www.saeil.mogef.go.kr)에서 더 많은 프로그램 정보를 확인하실 수 있습니다.",여성 경제활동 촉진 지원사업
경력을 이어가고 싶은 주부들을 위한 자원은 어디에서 찾을 수 있나요?,"경력을 이어가길 희망하는 주부들은 여성새로일하기센터를 통해 필요한 자원을 찾을 수 있습니다. 이에 대한 문의는 1544-1199로 할 수 있으며, 여성새로일하기센터 웹사이트(http://www.saeil.mogef.go.kr)에서 추가 정보를 얻으실 수 있습니다.",여성 경제활동 촉진 지원사업
여성을 위한 인턴 지원 프로그램에서 기업은 어떤 혜택을 받나요?,"기업은 여성새로일하기센터를 통해 연계된 인턴을 3개월간 고용할 경우 매월 80만 원씩의 인턴채용 지원금을 받습니다. 또한, 인턴을 상용직 또는 정규직으로 전환하고 6개월 이상 고용유지 시 추가로 고용유지 장려금 80만 원을 받게 됩니다.",여성 경제활동 촉진 지원사업
인턴채용 지원금 외에 여성 인턴이 받을 수 있는 장려금은 무엇인가요?,"여성 인턴은 인턴 기간 동안 월 80만 원의 지원금을 받으며, 인턴 기간 종료 후 정규직 전환 및 6개월간 고용이 유지될 경우 60만 원의 고용유지 장려금을 추가로 받을 수 있습니다.",여성 경제활동 촉진 지원사업
"여성 인턴십 프로그램 참여 시, 정규직 전환 이후의 인센티브는 무엇이 있나요?","정규직으로 전환된 여성 인턴이 6개월 이상 계속 근무할 경우, 인턴 본인은 60만 원의 고용유지 장려금을 받게 되며, 해당 기업 역시 80만 원의 장려금을 지원받게 됩니다.",여성 경제활동 촉진 지원사업
여성새로일하기센터에서 인턴십 기간은 얼마나 되나요?,여성새로일하기센터에서 인턴십 기간은 총 3개월입니다. 이 기간 동안 인턴과 기업은 인턴채용 지원금을 지원받습니다.,여성 경제활동 촉진 지원사업
인턴기간 동안 여성에게 지급되는 금액은 총 얼마인가요?,"인턴기간 동안 여성 인턴에게 지급되는 총액은 3개월 간 매월 80만 원씩으로, 총 240만 원입니다.",여성 경제활동 촉진 지원사업
인턴채용 지원금으로 지급되는 금액의 총 합계는 어떻게 되나요?,"인턴채용 지원금으로 3개월 간 매달 80만 원씩 지급되므로, 총 합계는 240만 원이 됩니다. 이와 별개로, 인턴이 정규직으로 전환되어 6개월 이상 근무하면 60만 원의 고용유지 장려금을 추가로 받게 됩니다.",여성 경제활동 촉진 지원사업
여성기업 종합지원센터의 지원 대상은 누구인가요?,여성 예비창업자와 창업 후 3년 이내인 여성기업이 지원 대상입니다.,여성기업 종합지원센터 운영
여성기업 종합지원센터의 지원에서 제외되는 사람에는 어떤 경우가 있나요?,"신용불량거래자, 국세나 지방세를 체납한 자, 그리고 정부지원 사업에 부적격한 자가 제외됩니다.",여성기업 종합지원센터 운영
창업한 지 4년 된 여성 사업주도 여성기업 종합지원센터의 혜택을 받을 수 있나요?,"아니요, 지원 대상은 창업 3년 미만의 여성기업에 한정되므로 4년 차 사업주는 해당하지 않습니다.",여성기업 종합지원센터 운영
여성기업 종합지원센터는 어떤 종류의 여성 창업자에게 도움을 제공하나요?,"모든 분야의 여성 예비창업자와 신생 여성기업가를 지원합니다, 단, 일정 요건을 충족해야 합니다.",여성기업 종합지원센터 운영
여성기업 종합지원센터 지원 제외 대상에 해당하는 신용불량거래자는 무엇을 의미하나요?,금융기관에서 거래 중에 신용 문제가 발생하여 신용불량자로 등록된 사람을 말합니다.,여성기업 종합지원센터 운영
기존에 다른 정부지원사업 참여로 인한 부적격자도 여성기업 종합지원센터 지원에서 제외되나요?,"네, 기존 정부지원사업 참여로 인해 부적격자로 판명된 경우 지원 대상에서 제외됩니다.",여성기업 종합지원센터 운영
여성 창업가가 창업 초기 지원을 받기 위해 서울 소재 여성기업 종합지원센터에 입주하려면 얼마의 보증금을 납부해야 하나요?,서울 소재 여성기업 종합지원센터에 입주하기 위해서는 150만 원의 보증금을 납부해야 합니다.,여성기업 종합지원센터 운영
비수도권에 위치한 여성기업 종합지원센터의 창업보육실 공간을 이용할 경우 월 관리비는 얼마인가요?,"비수도권에 위치한 창업보육실 공간을 이용할 때의 월 관리비는 평균 1만 5,000원/평/월입니다.",여성기업 종합지원센터 운영
여성기업 종합지원센터의 창업보육실 입주 기간은 기본적으로 어느 정도인가요?,여성기업 종합지원센터의 창업보육실의 기본 입주 기간은 입주일로부터 1년입니다.,여성기업 종합지원센터 운영
입주 기업이 창업보육실에서 지원받을 수 있는 최대 기간은 얼마인가요?,창업보육실 입주기업은 최대 3년까지 지원을 연장 받을 수 있습니다.,여성기업 종합지원센터 운영
여성기업 종합지원센터에서 제공하는 중요한 서비스 네 가지는 무엇이 있나요?,"경영지원, 교육 프로그램, 컨설팅 서비스, 국내외 마케팅 지원 등 네 가지 중요한 서비스를 제공합니다.",여성기업 종합지원센터 운영
여성기업 종합지원센터를 통해 기대할 수 있는 환경적 조성 사항은 무엇인가요?,여성기업 종합지원센터는 창업가에게 유리한 기업환경 조성을 지원합니다.,여성기업 종합지원센터 운영
여성기업 종합지원센터 입주를 위해 제출해야 할 가장 첫 번째 서류는 무엇인가요?,여성기업 종합지원센터에 입주하기 위해서는 우선 입주신청서를 제출해야 합니다.,여성기업 종합지원센터 운영
사업계획서를 제출한 다음에는 어떤 과정을 거치게 되나요?,"사업계획서 제출 이후에는 서류심사가 진행되고, 그 결과가 통보됩니다.",여성기업 종합지원센터 운영
여성기업 종합지원센터 입주를 위한 발표심사는 서류심사 이후에 언제 진행되나요?,서류심사 통과 후에 발표심사가 진행됩니다.,여성기업 종합지원센터 운영
"서류심사를 통과한 뒤 발표심사가 이루어지나요, 아니면 다른 절차가 먼저인가요?","네, 서류심사를 통과하면 바로 발표심사가 이루어집니다.",여성기업 종합지원센터 운영
최종 입주 여부는 어떤 단계에서 알 수 있나요?,"발표심사를 거친 뒤에 최종결과가 통보되며, 그 안에서 입주 여부를 알 수 있습니다.",여성기업 종합지원센터 운영
여성기업 종합지원센터에 입주하기 위한 마지막 절차는 무엇인가요?,입주 최종 승인을 받은 후 입주계약을 체결하면 입주 절차가 완료됩니다.,여성기업 종합지원센터 운영
여성 창업자를 위한 지원 프로그램을 알고 싶어요.,"여성 창업자를 위한 다양한 지원 프로그램은 여성기업종합지원센터를 통해 문의하실 수 있습니다. 전화번호는 02-369-0993이며, 더 많은 정보는 웹사이트 http://www.wesc.or.kr 에서 확인하세요.",여성기업 종합지원센터 운영
여성기업종합지원센터의 서비스에 대해 상담받고 싶어요. 어디로 연락해야 하나요?,"여성기업종합지원센터의 다양한 서비스에 대한 상담은 전화로 02-369-0993 번호로 문의하실 수 있고, 온라인으로는 http://www.wesc.or.kr 웹사이트를 방문해주시기 바랍니다.",여성기업 종합지원센터 운영
여성기업 종합정보포털 사이트 주소를 알려주세요.,여성기업 종합정보포털은 http://www.wbiz.or.kr 주소를 통해 접속 가능합니다. 여성기업에 관련된 유용한 정보를 찾아보실 수 있습니다.,여성기업 종합지원센터 운영
여성기업종합지원센터에 어떤 도움을 받을 수 있나요?,"여성기업을 위한 상담, 교육 프로그램, 네트워킹 기회 제공 등 다양한 지원을 받으실 수 있습니다. 자세한 내용은 02-369-0993으로 연락하시거나 http://www.wesc.or.kr 에서 확인하시기 바랍니다.",여성기업 종합지원센터 운영
여성기업종합지원센터에 문의하고 싶은데 영업시간이 어떻게 되나요?,"여성기업종합지원센터의 운영시간은 사이트나 전화를 통해 확인하시길 바랍니다. 전화번호는 02-369-0993, 웹사이트 주소는 http://www.wesc.or.kr 입니다.",여성기업 종합지원센터 운영
여성기업 종합정보포털에서 제공하는 정보의 종류는 무엇인가요?,"여성기업 종합정보포털에서는 창업 지원, 정부지원 사업, 교육 및 훈련 프로그램 등 여성기업과 관련된 종합적인 정보를 제공합니다. 웹사이트는 http://www.wbiz.or.kr 에서 서비스를 이용하실 수 있습니다.",여성기업 종합지원센터 운영
여성기업 판로역량 강화지원 대상에 해당하는 기업 유형은 무엇인가요?,해당 프로그램의 대상은 소비재를 생산하거나 판매하는 여성기업입니다.,여성기업 판로역량 강화지원
"나의 회사가 여성기업 판로역량 강화지원을 받을 수 있는 조건이 궁금합니다, 어떤 기업들이 해당되나요?",조건으로는 여성이 소유하고 운영하는 기업 중에서 소비재를 다루는 기업이 해당됩니다.,여성기업 판로역량 강화지원
여성이 경영하는 기업도 판로역량 강화지원을 신청할 수 있나요?,"네, 여성이 경영하는 기업 중 소비재를 생산하거나 판매하는 기업이라면 신청 가능합니다.",여성기업 판로역량 강화지원
여성기업이 홈쇼핑에 입점할 때 최대 얼마까지 지원받을 수 있나요?,여성기업은 공영홈쇼핑 방송 송출료를 최대 1050만 원까지 지원받을 수 있습니다.,여성기업 판로역량 강화지원
SNS 광고영상 제작 지원은 어떤 서비스를 이용할 때 지원되나요?,"인스타그램, 유튜브, 블로그 등 SNS 광고영상 제작비로 최대 200만 원까지 지원됩니다.",여성기업 판로역량 강화지원
여성기업을 위한 디지털 판로전략 교육은 몇 회 실시되나요?,여성기업을 위한 디지털 판로전략 교육은 총 4회 실시됩니다.,여성기업 판로역량 강화지원
대형유통사 MD를 초청하는 구매상담회에서는 어떤 형태의 지원이 제공되나요?,대형유통사 MD 초청 구매상담회에서는 맞춤형 판매전략에 대한 4회 컨설팅을 지원받을 수 있습니다.,여성기업 판로역량 강화지원
여성기업의 이커머스 진출에 도움을 주는 교육 프로그램에 관해 물어볼 수 있나요?,"네, 여성기업 판로역량 강화 프로그램의 일환으로 이커머스를 포함한 다양한 판로에 대한 교육이 제공됩니다.",여성기업 판로역량 강화지원
여성기업을 위한 2023년 마케팅 전략 교육은 얼마나 자주 제공되나요?,2023년 마케팅 전략 교육은 4회에 걸쳐 여성기업에게 제공됩니다.,여성기업 판로역량 강화지원
여성기업의 판로 확대를 위한 지원 프로그램에 참여하려면 어떤 과정을 거쳐야 하나요?,"참여를 희망하는 여성기업은 먼저 모집 과정에 참여해야 하며, 이후 교육을 받고, 상품 품평회를 거친 후, 판로별 입점과 미디어 홍보 단계로 지원을 받게 됩니다.",여성기업 판로역량 강화지원
여성기업 판로역량 강화 지원 프로그램에서 교육은 어떤 역할을 하나요?,"교육 단계는 여성기업이 시장에 진출하기 전 필요한 판매 전략, 마케팅 기술 등을 배우는 역량 강화의 기회를 제공합니다.",여성기업 판로역량 강화지원
품평회에 참여하는 것이 여성기업에게 어떤 이점을 주나요?,"품평회 참여는 여성기업의 제품이 시장에서 어떻게 평가받을 수 있는지 피드백을 얻고, 이를 통해 제품 개선 및 발전을 도모하는 기회를 제공합니다.",여성기업 판로역량 강화지원
판로별 입점 지원이란 무엇을 의미하나요?,"판로별 입점 지원은 여성기업이 온라인, 오프라인 매장 등 다양한 유통 채널에 입점할 수 있도록 실질적인 도움을 제공하는 서비스를 말합니다.",여성기업 판로역량 강화지원
여성기업은 어떻게 미디어 홍보의 혜택을 받을 수 있나요?,"여성기업은 교육과 품평회를 거친 후 지원 프로그램을 통해 미디어 홍보 기회를 얻을 수 있으며, 이를 통해 브랜드 인지도 상승 및 고객 범위 확대 등의 효과를 누릴 수 있습니다.",여성기업 판로역량 강화지원
여성기업 판로역량 강화 지원을 신청할 때 필요한 사항은 무엇이 있나요?,"신청 시 여성기업으로서의 등록증명, 사업계획서, 제품 정보 및 기타 필요한 서류가 요구될 수 있습니다. 구체적인 요구 사항은 모집 공고문을 확인하여 준비하는 것이 좋습니다.",여성기업 판로역량 강화지원
"여성 창업자를 위한 판로 지원 프로그램에 대해 알아보고 싶어요, 어디로 연락해야 할까요?",여성 창업자를 위한 판로 지원 프로그램에 대한 정보는 한국여성경제인협회를 통해 확인하실 수 있습니다. 연락처는 02-369-0958이에요.,여성기업 판로역량 강화지원
제가 운영하는 여성기업의 판매망 확장을 도와줄 수 있는 서비스가 있다고 들었는데 어떻게 신청하나요?,판매망 확장과 관련된 서비스는 한국여성경제인협회에서 제공하고 있습니다. 서비스 신청을 위해서는 02-369-0958로 전화 문의하시면 됩니다.,여성기업 판로역량 강화지원
"여성기업에 특화된 마케팅 지원을 받고 싶은데, 어디로 연락해야 하나요?",여성기업을 대상으로 한 특화된 마케팅 지원은 한국여성경제인협회에서 제공합니다. 지원에 대하여 더 알고 싶으시다면 02-369-0958로 연락하시면 도움을 받으실 수 있습니다.,여성기업 판로역량 강화지원
여성기업 확인서를 발급받기 위한 기본 요건은 무엇인가요?,여성기업 확인서를 발급 받기 위한 기본 요건은 기업이 여성의 소유이며 여성이 직접 경영을 하고 있어야 한다는 점입니다.,여성기업 확인서 발급
여성 소유 및 경영 기업임을 증명할 수 있는 공식 서류는 무엇이 있죠?,여성 소유 및 경영 기업임을 공식적으로 증명할 수 있는 서류는 '여성기업 확인서'입니다.,여성기업 확인서 발급
내가 운영하는 회사가 여성기업 확인 서류 발급 대상인지 어떻게 알 수 있나요?,"회사가 여성기업 확인 서류 발급 대상인지 알고 싶다면, 회사의 소유주가 여성인지, 그리고 회사의 실질적 경영을 여성이 담당하고 있는지 확인해야 합니다.",여성기업 확인서 발급
여성이 소유하고 경영하는 회사에 대한 혜택을 받기 위해 필요한 서류는 무엇인가요?,여성이 소유하고 경영하는 회사는 여성기업 확인서를 발급받음으로써 공공구매 시장 접근의 우대 혜택 및 정부지원사업에 참여할 때 우대받을 수 있습니다.,여성기업 확인서 발급
정부의 여성기업 지원책 중 공공조달과 관련된 서류는 어떻게 발급받나요?,공공조달에 참여하며 정부지원을 받기 위해서는 여성기업 확인서를 발급받아야 합니다. 이 서류는 여성이 대표로 있는 기업이 자격을 갖추었음을 공식적으로 인증하는 문서입니다.,여성기업 확인서 발급
소상공인 여성경영자가 정부 우대 지원 프로그램을 신청하려면 어떤 인증을 받아야 하나요?,소상공인 여성경영자는 정부의 우대 지원 프로그램을 신청하기 위해 여성기업 확인서를 발급 받아야 합니다. 이는 여성이 소유하고 경영하는 기업임을 증명하는 공식 서류입니다.,여성기업 확인서 발급
여성기업 확인서는 어떻게 신청하나요?,여성기업 확인서는 중소기업 공공구매 종합정보 웹사이트를 통해 연중 수시로 온라인으로 신청하실 수 있습니다. 웹사이트 주소는 http://www.smpp.go.kr 입니다.,여성기업 확인서 발급
여성기업 확인서 발급 시 현장조사는 어떻게 이루어지나요?,"여성기업 확인서 발급을 위한 현장조사는 원칙적으로 여성 대표자와의 면담을 통해 경영활동에 실질적으로 참여하는지 확인합니다. 단, 특정 경우에는 서면조사나 비대면조사도 가능합니다.",여성기업 확인서 발급
재신청 기업의 여성기업 확인서 현장조사 방법에는 어떤 것이 있나요?,"재신청 기업의 경우, 유효기간 만료 등의 이유로 발급을 재신청할 때는 서면조사로 진행됩니다.",여성기업 확인서 발급
코로나19 같은 예외 상황에서는 여성기업 현장조사를 어떻게 진행하나요?,"코로나19와 같은 감염병이 발생하거나 재난이 있을 때, 또는 도서산간 지역의 업체에 대해서는 비대면조사로 진행할 수 있습니다.",여성기업 확인서 발급
여성기업 확인서 발급 절차에는 어떤 단계들이 포함되어 있나요?,"여성기업 확인서 발급 절차는 온라인 신청, 서류제출 및 서류검토, 현장조사, 확인서 발급 여부 결정과 결과 통보, 그리고 온라인으로 확인서를 출력하는 단계를 포함하고 있습니다.",여성기업 확인서 발급
여성기업 확인서 발급 후 어떤 사후 관리가 있나요?,확인서 발급 후에는 확인서 출력을 마친 뒤 정해진 절차에 따라 사후 관리가 이루어집니다.,여성기업 확인서 발급
여성기업 확인서는 어디서 발급받을 수 있나요?,여성기업 확인서는 한국여성경제인협회에서 발급받으실 수 있습니다.,여성기업 확인서 발급
한국여성경제인협회 연락처를 알려주세요.,한국여성경제인협회의 연락처는 02-369-0932입니다.,여성기업 확인서 발급
여성기업을 증명하는 문서를 어떻게 발급받나요?,여성기업 확인서 발급을 위해서는 한국여성경제인협회에 문의하시면 됩니다.,여성기업 확인서 발급
여성기업 확인서 발급을 위한 웹사이트 주소를 알려주세요.,여성기업 확인서 발급과 관련된 정보는 http://www.wbiz.or.kr 웹사이트에서 확인하실 수 있습니다.,여성기업 확인서 발급
한국여성경제인협회 웹사이트로 들어가는 방법을 알고 싶어요.,한국여성경제인협회의 공식 웹사이트 주소는 http://www.wbiz.or.kr입니다. 해당 주소를 웹 브라우저에 입력하시면 사이트에 접속하실 수 있습니다.,여성기업 확인서 발급
여성기업 확인을 위한 문서를 받으려면 어떻게 해야 하나요?,"여성기업 확인을 위한 문서, 즉 여성기업 확인서는 한국여성경제인협회로 문의하여 발급받을 수 있습니다.",여성기업 확인서 발급
여성 기업가가 여성창업액셀러레이팅 프로그램에 지원하기 위해 충족해야 할 조건이 무엇인가요?,"여성 예비창업자 또는 창업 후 3년이 지나지 않은 여성 기업가로서, 투자유치 금액이 30억 원 미만인 경우에 지원할 수 있습니다.",여성창업액셀러레이팅
"만약 나의 스타트업이 투자를 32억 원 받았다면, 여성창업액셀러레이팅 프로그램에 참여할 수 없나요?","네, 그렇습니다. 해당 프로그램은 투자유치 금액이 30억 원 미만인 여성 기업가를 대상으로 하기 때문에, 32억 원을 유치한 스타트업은 지원 자격이 없습니다.",여성창업액셀러레이팅
여성 예비창업자를 위한 액셀러레이팅 서비스가 있나요? 제 조건에 맞는 프로그램을 찾고 싶어요.,"예, 여성창업액셀러레이팅 서비스가 있으며, 예비창업자이거나 창업 3년 미만인 경우에 지원이 가능합니다. 본인의 사업 조건이 해당되는지 확인하시고 지원해 보시면 좋을 것 같습니다.",여성창업액셀러레이팅
여성창업액셀러레이팅 프로그램에서 제공하는 교육 컨설팅은 어떤 내용인가요?,여성창업액셀러레이팅 프로그램에서 제공하는 교육 컨설팅은 참가자의 비즈니스 모델을 고도화하기 위한 사업계획서 작성법 등의 내용을 포함합니다.,여성창업액셀러레이팅
여성창업액셀러레이팅 프로그램의 수상자는 몇 팀인가요?,여성창업액셀러레이팅 프로그램의 수상자는 총 32팀입니다.,여성창업액셀러레이팅
'도전 K-스타트업 본선 진출'이 여성창업액셀러레이팅의 어떤 부분에 해당하는가요?,'도전 K-스타트업 본선 진출'은 여성창업액셀러레이팅 프로그램의 후속지원 부분에 해당합니다. 이는 상위 30팀 이내를 대상으로 합니다.,여성창업액셀러레이팅
여성창업액셀러레이팅 후속지원에서 초기 사업화 자금은 얼마나 지원되나요?,여성창업액셀러레이팅 후속지원에서는 초기 사업화 자금으로 기업당 약 500만 원 내외가 지원됩니다.,여성창업액셀러레이팅
여성창업가들이 액셀러레이팅 프로그램을 통해 받을 수 있는 네트워킹 지원은 무엇을 의미하나요?,네트워킹 지원은 창업가들이 서로 정보를 공유하고 협력할 수 있는 기회를 제공함으로써 사업 성공 가능성을 높이는 활동을 말합니다.,여성창업액셀러레이팅
"프로그램 참가자들이 투자유치 연계 지원을 받을 수 있다고 하는데, 이는 구체적으로 어떤 도움을 제공하나요?","투자유치 연계 지원은 참가자들이 투자자들과의 만남을 가질 수 있도록 장을 마련하고, 자본을 확보할 기회를 제공하여 사업 성장을 도와줍니다.",여성창업액셀러레이팅
여성 기업가 지원을 위한 액셀러레이팅 프로그램 신청 기간이 궁금합니다. 언제 신청할 수 있나요?,여성창업액셀러레이팅 프로그램 신청은 매년 3월에서 4월 사이에 접수를 받습니다. 정확한 기간은 공고를 확인하시기 바랍니다.,여성창업액셀러레이팅
여성창업액셀러레이팅 사업계획 수립 및 공고 시기에 대해 알고 싶어요.,여성창업액셀러레이팅의 사업계획 수립 및 공고는 보통 1월에서 2월 사이에 이루어집니다.,여성창업액셀러레이팅
