Question,Answer,Documents
"창업을 준비 중인데, 창업기숙사 사업을 통해 어떤 지원을 받을 수 있나요?","창업기숙사 사업을 통해 창업 준비에 필요한 숙소를 제공받을 수 있으며, 창업에 관련된 다양한 멘토링 및 네트워킹 기회도 함께 제공됩니다. 이를 통해 창업 과정에서 필요한 다양한 지원을 받을 수 있습니다.",창업기숙사 사업
기창업자도 창업기숙사 사업의 혜택을 받을 수 있나요?,"예, 이미 창업을 한 대학(원)생도 창업기숙사 사업의 대상에 포함되어 지원을 받을 수 있습니다. 사업을 통해 지속적인 창업 활동과 성장에 필요한 지원을 얻을 수 있습니다.",창업기숙사 사업
창업을 준비하는데 창업기숙사가 제공하는 주거공간에 포함된 편의시설은 무엇인가요?,"창업기숙사에서는 주거공간으로 사생실, 세탁실, 공용주방 등의 편의시설을 지원합니다.",창업기숙사 사업
창업기숙사 사업에 지원하려면 어디로 문의해야 하나요?,"창업기숙사 사업에 대한 지원 문의는 해당되는 지역 센터에 연락하시면 됩니다. 창업기숙사 사업은 서울, 부산, 대구, 광주, 대전에 센터를 두고 있습니다.",창업기숙사 사업
대전센터의 창업기숙사는 몇 명을 수용할 수 있나요?,대전센터의 창업기숙사는 총 28명의 창업가를 수용할 수 있는 정원을 가지고 있습니다.,창업기숙사 사업
선배 창업가와의 네트워킹 기회도 제공하나요?,"네, 창업기숙사 사업은 창업 네트워크 형성을 위하여 선배창업가, 입주생, 투자자와의 관계형성을 지원합니다.",창업기숙사 사업
온라인 홍보관 운영 지원은 어떤 목적으로 제공되나요?,온라인 홍보관 운영 지원은 창업가들이 제품이나 서비스를 홍보할 수 있도록 도와 판로개척을 지원하는 목적을 가지고 있습니다.,창업기숙사 사업
창업가를 위한 세미나실과 멘토링실은 어느 공간 지원에 포함되나요?,창업가들을 위한 세미나실과 멘토링실은 창업공간 지원에 포함됩니다. 임대형사무실과 함께 창업 활동을 위한 공간을 제공합니다.,창업기숙사 사업
창업기숙사에 어떻게 신청할 수 있나요?,창업기숙사 사업은 한국장학재단 누리집에서 온라인으로 신청할 수 있습니다.,창업기숙사 사업
차년도 상반기 창업기숙사 입주생은 언제부터 신청할 수 있나요?,"상반기 모집의 경우, 매년 12월 중에 차년도 입주생 모집공고가 있으며, 차년도 2월에 입주가 가능합니다.",창업기숙사 사업
한국장학재단 누리집의 정확한 웹사이트 주소를 알려주세요.,한국장학재단의 누리집 사이트 주소는 http://www.kosaf.go.kr 입니다.,창업기숙사 사업
"상반기에 신청하지 못했다면, 창업기숙사 입주를 위한 다른 기회가 있나요?",하반기에 공실이 발생한 경우 추가 모집을 할 수 있으므로 그 기회를 이용할 수 있습니다.,창업기숙사 사업
창업기숙사 입주 신청은 연중 상시 가능한가요?,"아닙니다, 상반기 모집은 12월에 공고된 후 2월에 입주가 가능하며, 나머지 기간에는 공실이 있을 때 추가 모집이 진행됩니다.",창업기숙사 사업
하반기 창업기숙사 사업 모집은 어떻게 되나요?,"하반기 모집은 상반기와 달리 정해진 시기가 없고, 공실이 발생했을 때 추가로 모집을 진행합니다.",창업기숙사 사업
창업기숙사를 운영하는 기관에 연락하려면 어디로 전화해야 하나요?,창업기숙사 사업에 대해서는 한국장학재단에 문의하시면 됩니다. 연락처는 1599-2290입니다.,창업기숙사 사업
창업을 준비하는 학생이 창업기숙사 혜택을 받으려면 어떻게 해야 하나요?,"창업 준비 중인 학생이 창업기숙사 혜택을 이용하고자 한다면, 한국장학재단으로 문의하셔야 합니다. 전화번호는 1599-2290이며, 자세한 정보는 웹사이트에서 확인 가능합니다.",창업기숙사 사업
한국장학재단에서 제공하는 창업지원 프로그램에 대해 알고 싶어요. 어디로 문의해야 하죠?,"한국장학재단에서 제공하는 창업지원 프로그램에 대한 정보는 한국장학재단에 직접 문의하시면 됩니다. 전화번호는 1599-2290이며, 자세한 내용은 한국장학재단의 공식 웹사이트에서 확인할 수 있습니다.",창업기숙사 사업
예비 창업자 대상의 기숙사 문의는 어디서 할 수 있나요?,예비 창업자를 위한 창업기숙사와 관련된 사항은 한국장학재단에 문의하시는 것이 좋습니다. 전화번호는 1599-2290입니다.,창업기숙사 사업
한국장학재단의 창업기숙사 신청 방법을 알려주세요.,한국장학재단의 창업기숙사 신청과 관련된 정보는 한국장학재단으로 전화하셔서 안내받으실 수 있습니다. 연락처는 1599-2290입니다.,창업기숙사 사업
"창업기숙사에 입사하고 싶은데, 어느 기관에 연락해야 하나요?","창업기숙사 입사를 원하신다면 한국장학재단으로 연락해야 합니다. 연락 가능한 전화번호는 1599-2290이며, 웹사이트를 통해서도 정보를 얻을 수 있습니다.",창업기숙사 사업
K-디지털 트레이닝에 참여하기 위한 자격 요건에 대해 알려줄 수 있나요?,"K-디지털 트레이닝은 국민 누구나 신청할 수 있지만, 공무원, 사립학교 교직원, 연매출 1억 5천만 원 이상의 자영업자, 월 소득 300만 원 이상을 버는 대규모 기업의 근로자 및 특수형태근로종사자(만 45세 미만), 졸업까지 2년을 초과하는 학업 기한이 남은 대학 재학생, 그리고 만 75세 이상의 노인은 지원에서 제외됩니다.",첨단산업 디지털 핵심 실무인재 양성훈련(K-Digital Training)
K-디지털 트레이닝 프로그램 지원 자격 중 연령 제한이 있나요?,"네, 있습니다. 해당 프로그램은 만 75세 이상인 개인에 대해서는 지원을 제외하고 있습니다.",첨단산업 디지털 핵심 실무인재 양성훈련(K-Digital Training)
만약 연매출 1억 6천만 원의 자영업을 하고 있다면 K-디지털 트레이닝 지원이 가능한가요?,"아니요, 연매출 1억 5천만 원 이상의 자영업자는 K-디지털 트레이닝 프로그램 지원 자격이 없습니다.",첨단산업 디지털 핵심 실무인재 양성훈련(K-Digital Training)
대기업에서 근무하는 30대 후반 직원도 K-디지털 트레이닝 참여가 가능한가요?,월 임금이 300만 원 이상인 경우에는 참여가 불가능합니다. 연령에 따른 직접적인 제한은 만 45세 미만의 특수형태근로종사자에게만 적용되므로 연령만으로는 제한되지 않습니다.,첨단산업 디지털 핵심 실무인재 양성훈련(K-Digital Training)
"대학교에 재학 중인데, K-디지털 트레이닝 신청 자격이 되나요?","대학 재학 중인 경우, 졸업까지 남은 수업 연한이 2년을 초과하지 않아야 합니다. 그 이상 남았다면 지원 자격이 없습니다.",첨단산업 디지털 핵심 실무인재 양성훈련(K-Digital Training)
사립학교 교직원도 K-디지털 트레이닝을 통해 실무 역량을 키울 수 있나요?,"아니요, 사립학교 교직원은 프로그램 지원 대상이 아닙니다. K-디지털 트레이닝은 사립학교 교직원을 지원 제외 대상으로 하고 있습니다.",첨단산업 디지털 핵심 실무인재 양성훈련(K-Digital Training)
K-Digital Training 프로그램에 참여하면 어떤 혜택을 받을 수 있나요?,K-Digital Training 프로그램은 훈련비 전액을 지원하고 훈련 기간 동안 매월 최대 31만 6000원의 훈련수당을 추가로 제공합니다.,첨단산업 디지털 핵심 실무인재 양성훈련(K-Digital Training)
"디지털 분야의 실무적 지식을 쌓고 싶은데, K-Digital Training은 무엇인가요?","K-Digital Training은 디지털 기술 중심의 첨단산업 분야에서 요구하는 실무능력을 갖춘 인재를 양성하는 교육 프로그램이며, 참가자에게는 훈련비 전액과 생활비 지원의 형태로 매월 최대 31만 6000원의 수당이 지급됩니다.",첨단산업 디지털 핵심 실무인재 양성훈련(K-Digital Training)
K-Digital Training 참여 시 받는 훈련수당의 정확한 금액은 얼마인가요?,K-Digital Training 참여자는 매월 최대 31만 6000원의 훈련수당을 추가로 받을 수 있습니다.,첨단산업 디지털 핵심 실무인재 양성훈련(K-Digital Training)
"첨단산업 분야 일자리를 원하는데, 어떻게 K-Digital Training 프로그램에 지원할 수 있나요?","K-Digital Training 프로그램은 해당 분야의 실무능력 향상을 목표로 하며, 지원 방법은 프로그램의 공식 웹사이트 또는 연계된 교육기관에서 확인하고 지원 절차를 밟을 수 있습니다. 훈련비 전액과 월 최대 31만 6000원의 훈련수당도 지원됩니다.",첨단산업 디지털 핵심 실무인재 양성훈련(K-Digital Training)
K-Digital Training은 어떤 분야의 실무 인재를 모집하나요?,"K-Digital Training은 디지털 기술을 기반으로 한 첨단산업 분야의 핵심 실무 인재를 모집하여 교육하며, 해당 프로그램을 통해 훈련비 전액과 추가적으로 최대 월 31만 6000원의 훈련수당을 지원받을 수 있습니다.",첨단산업 디지털 핵심 실무인재 양성훈련(K-Digital Training)
K-Digital Training 프로그램 지원 시 필요한 비용은 얼마인가요?,"참가자에게는 훈련비 전액이 지원되기 때문에 K-Digital Training 프로그램 지원 시 추가 비용은 없으며, 오히려 훈련 기간 중 월 최대 31만 6000원의 훈련수당이 지원됩니다.",첨단산업 디지털 핵심 실무인재 양성훈련(K-Digital Training)
K-Digital Training 국민내일배움카드 신청 방법을 알려주세요.,K-Digital Training 국민내일배움카드는 가까운 고용센터를 방문하거나 HRD-Net 웹사이트를 통해 신청할 수 있습니다.,첨단산업 디지털 핵심 실무인재 양성훈련(K-Digital Training)
"인근 고용센터를 방문하지 않고, K-Digital Training 신청하는 다른 방법은 무엇인가요?",온라인으로 HRD-Net 웹사이트를 통해 K-Digital Training을 신청할 수 있습니다.,첨단산업 디지털 핵심 실무인재 양성훈련(K-Digital Training)
새로운 디지털 기술을 배우고 싶어요. K-Digital Training 어떻게 등록하나요?,K-Digital Training 과정에 등록하기 위해서는 HRD-Net 웹사이트를 통한 온라인 수강신청 절차를 밟아야 합니다.,첨단산업 디지털 핵심 실무인재 양성훈련(K-Digital Training)
고용센터 방문 없이도 K-Digital Training 참여가 가능한가요?,"네, 가능합니다. HRD-Net 웹사이트를 이용하여 온라인으로 신청하세요.",첨단산업 디지털 핵심 실무인재 양성훈련(K-Digital Training)
K-Digital Training은 누구를 대상으로 하나요?,첨단산업 분야의 디지털 핵심 실무인재를 양성하는 과정이므로 IT 및 관련 분야에 경력을 쌓거나 진입을 희망하는 분들이 대상입니다.,첨단산업 디지털 핵심 실무인재 양성훈련(K-Digital Training)
K-Digital Training 프로그램 관련 정보는 어디에서 얻을 수 있나요?,이에 대한 정보는 HRD-Net 웹사이트에서 상세히 확인할 수 있습니다.,첨단산업 디지털 핵심 실무인재 양성훈련(K-Digital Training)
K-디지털 트레이닝이 무엇인가요?,"K-디지털 트레이닝은 첨단 산업 분야에서 필요한 디지털 실무 인재를 양성하기 위한 훈련 프로그램입니다. 자세한 내용은 직업훈련포털(http://www.hrd.go.kr)에서 확인하거나, 고용노동부 고객상담센터(전화번호: 1350)에 문의하세요.",첨단산업 디지털 핵심 실무인재 양성훈련(K-Digital Training)
K-디지털 트레이닝에 참여하고 싶어요. 어디로 연락해야 하나요?,"K-디지털 트레이닝 프로그램에 참여하고자 한다면 직업훈련포털 웹사이트(http://www.hrd.go.kr)를 방문하거나, 고용노동부 고객상담센터(전화번호: 1350)로 문의하여 안내를 받을 수 있습니다.",첨단산업 디지털 핵심 실무인재 양성훈련(K-Digital Training)
고용노동부에서 주관하는 디지털 관련 직업 훈련은 어디서 알아볼 수 있나요?,"고용노동부에서 주관하는 디지털 관련 직업 훈련 정보는 직업훈련포털(http://www.hrd.go.kr)에서 찾아볼 수 있으며, 추가 문의가 필요하시면 고용노동부 고객상담센터(전화번호: 1350)로 연락하시면 됩니다.",첨단산업 디지털 핵심 실무인재 양성훈련(K-Digital Training)
직업훈련포털에서는 어떤 정보를 제공하나요?,"직업훈련포털은 다양한 직업훈련 프로그램 정보를 제공하며, K-디지털 트레이닝과 같은 정부 지원 훈련에 대한 정보도 포함되어 있습니다. 방문하셔서 상세한 프로그램 안내 및 신청 방법을 확인할 수 있습니다.",첨단산업 디지털 핵심 실무인재 양성훈련(K-Digital Training)
직업훈련을 받으려면 어떤 요건을 충족해야 하나요?,"직업훈련 프로그램에 따라 요건이 달라질 수 있으니, 구체적인 조건은 직업훈련포털(http://www.hrd.go.kr)에서 확인하거나 고용노동부 고객상담센터(전화번호: 1350)에 문의하여 상담을 받는 것이 좋습니다.",첨단산업 디지털 핵심 실무인재 양성훈련(K-Digital Training)
고용노동부 고객상담센터의 운영 시간은 어떻게 되나요?,"고용노동부 고객상담센터의 상세한 운영 시간은 공식 웹사이트에서 확인하시거나, 전화번호 1350으로 직접 연락하여 확인할 수 있습니다. 이용 가능한 시간에 맞춰 문의하시면 도움을 받으실 수 있습니다.",첨단산업 디지털 핵심 실무인재 양성훈련(K-Digital Training)
"첨단 디지털 기술을 배워 직업 훈련을 받으려고 하는데, 어떤 과정들이 제공되나요?","K-Digital Training 사업에서는 AI와 빅데이터를 비롯해, 2023년부터 반도체, 로봇, 3D프린팅 등의 첨단산업 분야에 대한 교육과정을 제공합니다. 이 과정들은 기업의 실무와 연관된 내용으로 구성되어 있어 실무적 활용도가 높습니다.",첨단산업 디지털 핵심 실무인재 양성훈련(K-Digital Training)
이 훈련 과정에 참여하면 진짜 기업 프로젝트에 참여해 볼 수 있나요?,"네, 참여하는 기업들은 실제 인력 수요를 반영하며, 훈련 과정의 최소 30% 이상이 기업의 진행 프로젝트를 기반으로 한 과제로 편성되어 있어 실제와 같은 경험을 제공합니다.",첨단산업 디지털 핵심 실무인재 양성훈련(K-Digital Training)
K-Digital Training의 훈련 기간은 어떻게 되나요?,"해당 훈련 과정은 평균 6개월 동안 진행되며, 주 5일, 하루 8시간의 집중적인 교육 시간을 가집니다.",첨단산업 디지털 핵심 실무인재 양성훈련(K-Digital Training)
디지털 신기술 훈련 사업에 참여하는 기관에는 어떤 곳들이 있나요?,"이 사업에는 KT, 삼성과 같은 선도 기업들과 서울대, 한양대 등 우수 대학들이 협력하여 훈련 과정을 설계하고 운영합니다.",첨단산업 디지털 핵심 실무인재 양성훈련(K-Digital Training)
K-Digital Training은 어떤 실무 능력에 중점을 두고 교육하나요?,이 훈련과정은 특히 경험과 문제 해결 능력을 중점으로 두고 운영됩니다. 이를 통해 교육생들은 실무에 바로 적용 가능한 능력을 개발할 수 있습니다.,첨단산업 디지털 핵심 실무인재 양성훈련(K-Digital Training)
"혹시 미래 첨단산업으로 진로를 잡고 싶은데, K-Digital Training 사업이 해당 분야로 진출하는 데 어떤 도움이 될까요?","이 사업은 실무 중심의 고급인력을 양성하여 첨단산업 분야, 특히 반도체, 로봇, 3D프린팅 등의 분야로의 진출에 큰 도움이 됩니다. 교육과정과 기업의 실무 프로젝트 참여를 통해 실무능력을 강화시켜주기 때문입니다.",첨단산업 디지털 핵심 실무인재 양성훈련(K-Digital Training)
청년내일저축계좌에 가입하려면 몇 살이어야 하나요?,"청년내일저축계좌의 가입연령 기준은 일반적으로 신청 당시 만 19세 이상 만 34세 이하입니다. 다만, 수급자 또는 차상위계층에 속하는 경우 연령 범위가 확장되어 15세 이상 39세 이하까지 가능합니다.",청년내일저축계좌
청년내일저축계좌에 신청할 때 필요한 월 소득 조건이 어떻게 되나요?,청년내일저축계좌의 월 소득 조건은 근로소득이나 사업소득이 월 50만 원을 초과하고 220만 원 이하인 경우에 해당됩니다. 수급자와 차상위계층은 월 소득이 10만 원 이상이면 신청이 가능합니다.,청년내일저축계좌
청년내일저축계좌 신청 시 고려해야 하는 가구소득 기준은 무엇인가요?,청년내일저축계좌 신청을 위한 가구소득 기준은 중위소득 100% 이하여야 합니다.,청년내일저축계좌
청년내일저축계좌 신청 자격이 되는 재산 기준은 어떻게 되나요?,"청년내일저축계좌의 재산 기준은 지역별로 다르게 적용됩니다: 대도시는 3억 5천만 원 이하, 중소도시는 2억 원 이하, 농어촌은 1억 7천만 원 이하의 재산을 가진 경우에 신청할 자격이 있습니다.",청년내일저축계좌
대도시에 거주하는 경우 청년내일저축계좌의 재산 기준은 어떻게 되나요?,"대도시에 사는 경우, 청년내일저축계좌의 재산 기준은 3억 5천만 원 이하여야 신청할 수 있습니다.",청년내일저축계좌
차상위계층은 청년내일저축계좌에 가입하기 위한 나이 제한이 어떻게 되나요?,차상위계층인 경우 청년내일저축계좌의 가입연령이 확대되어 만 15세 이상 만 39세 이하인 사람이 신청이 가능합니다.,청년내일저축계좌
청년내일저축계좌의 가장 큰 특징이 무엇인가요?,"청년내일저축계좌의 가장 큰 특징은 정부가 본인이 매월 저축하는 금액과 동일한 금액을 매칭하여 지원해주는 것입니다. 본인이 10만 원을 저축하면 중위소득에 따라 정부에서 10만 원 또는 30만 원을 추가로 적립해주며, 이러한 매칭은 3년 간 지속됩니다.",청년내일저축계좌
청년내일저축계좌를 통해 받을 수 있는 정부지원금의 금액은 어떻게 결정되나요?,"정부지원금의 금액은 본인의 소득 수준, 즉 중위소득에 따라 결정됩니다. 중위소득 50% 이하인 경우, 본인이 매월 저축하는 10만 원에 대해 정부에서 30만 원을 지원하고, 중위소득 50%를 초과하면서 100% 이하인 경우에는 10만 원을 지원받을 수 있습니다.",청년내일저축계좌
청년내일저축계좌 이용자가 주의해야 할 입금 마감일은 언제인가요?,청년내일저축계좌 이용 시 본인 저축액에 대한 정부 지원을 받기 위해서는 매월 전월 23일부터 현월 22일 입금 마감일 이전에 본인 저축액을 납입해야 합니다.,청년내일저축계좌
청년내일저축계좌를 유지하기 위한 조건에는 어떤 것들이 있나요?,"청년내일저축계좌를 유지하기 위해서는 3년간 통장을 유지하는 것 외에도 근로활동을 지속하고, 필수 교육을 이수하며, 자금사용 계획서를 제출해야 적립금을 전액 지급받을 수 있습니다.",청년내일저축계좌
생계급여 수급 중인 청년이 청년내일저축계좌를 이용할 경우 특별한 혜택이 있나요?,"네, 생계급여를 수급하는 청년은 청년내일저축계좌를 통해 정책대상별 추가지원금인 근로소득공제금을 받을 수 있는 특별 혜택이 있습니다.",청년내일저축계좌
"내일키움장려금과 내일키움수익금은 무엇이며, 청년내일저축계좌와 어떤 관련이 있나요?","내일키움장려금과 내일키움수익금은 청년내일저축계좌 이용자에게 제공되는 추가지원금입니다. 이는 저축과 더불어 탈수급을 장려하고, 장기적인 자산형성을 돕기 위한 장려금으로, 청년내일저축계좌 정책에 따라 지급됩니다.",청년내일저축계좌
저축 계좌를 온라인으로 어디에서 개설할 수 있나요?,청년내일저축계좌는 복지로 웹사이트(http://www.bokjiro.go.kr)를 통해 온라인 신청할 수 있습니다.,청년내일저축계좌
만약 내일저축계좌를 직접 방문해 신청하고 싶다면 어디로 가야 하나요?,청년내일저축계좌의 방문 신청은 주소지에 해당하는 읍면동 주민센터(행정복지센터)에서 할 수 있습니다.,청년내일저축계좌
청년내일저축계좌를 신청하기 위한 복지로 홈페이지의 정확한 URL 주소는 무엇인가요?,복지로 홈페이지의 URL 주소는 'http://www.bokjiro.go.kr'입니다. 이 주소를 통해서 해당 서비스에 대한 신청이 가능합니다.,청년내일저축계좌
내일저축계좌 관련 복지 서비스는 어떤 경로로 신청할 수 있나요?,"온라인은 복지로 웹사이트를 통해, 또는 거주지의 읍면동 주민센터(행정복지센터)를 방문하여 신청할 수 있습니다.",청년내일저축계좌
주소지 관할 행정복지센터에서 제공하는 복지 서비스 중 하나인 청년내일저축계좌는 어떻게 확인할 수 있나요?,해당 서비스는 지역의 읍면동 주민센터를 방문하여 자세한 안내 및 신청 절차를 받을 수 있습니다.,청년내일저축계좌
"내일저축계좌 신청에 필요한 복지로 웹사이트를 방문하고 싶은데, 정확한 주소를 모르겠어요. 어디서 찾을 수 있나요?",청년내일저축계좌 신청을 위한 복지로 웹사이트의 주소는 'http://www.bokjiro.go.kr'입니다. 이곳에서 관련 정보 및 신청 절차를 확인할 수 있습니다.,청년내일저축계좌
청년들을 위한 저축 지원 제도에 관심이 있어요. 어떻게 신청하나요?,청년내일저축계좌에 대해 문의하시려면 보건복지상담센터에 연락 주시면 됩니다. 상담센터의 전화번호는 129입니다.,청년내일저축계좌
"청년내일저축계좌는 무엇이며, 어떤 혜택이 있나요?",청년내일저축계좌는 저소득 청년들의 자산형성을 돕기 위한 제도입니다. 상세한 혜택과 신청 방법은 보건복지상담센터(전화 129)로 문의하실 수 있습니다.,청년내일저축계좌
129번으로 전화하면 어떤 상담을 받을 수 있나요?,"129번, 즉 보건복지상담센터에서는 청년내일저축계좌와 같은 복지정보뿐만 아니라 다양한 보건복지 관련 안내와 상담을 제공합니다.",청년내일저축계좌
청년내일채움공제에서 지원 대상이 되는 신규 취업 청년은 어떤 기준을 만족해야 하나요?,"신규 취업 청년은 최종학교 졸업 후 고용보험 가입 이력이 12개월 이하여야 하며, 월 임금총액이 300만 원 이하여야 지원 대상이 됩니다.",청년내일채움공제
5인 이상 50인 미만 건설 및 제조업 중소기업의 청년 채용일 직전 고용보험 피보험자수 조건은 무엇인가요?,해당 중소기업은 채용일 직전 3개월 평균으로 고용보험 피보험자수가 5인 이상 50인 미만이어야 합니다.,청년내일채움공제
청년내일채움공제의 혜택을 받으려면 중소기업의 규모에 어떤 제한이 있나요?,지원받으려는 중소기업은 5인 이상 50인 미만의 건설 및 제조업 중소기업이어야 합니다.,청년내일채움공제
청년내일채움공제 신청 자격에 관해 상세히 알려주세요.,이 제도는 고용보험에 처음 가입한 지 12개월 이내의 청년과 단기간 내 신규 인력을 필요로 하는 5인 이상 50인 미만의 건설과 제조업 분야 중소기업을 대상으로 합니다.,청년내일채움공제
"만약 제가 최근에 졸업했다면, 청년내일채움공제를 받기 위한 고용보험 가입 이력 기준은 어떻게 됩니까?","최종학교 졸업 후 고용보험이 처음인 경우, 가입 이력이 12개월 이하여야 청년내일채움공제의 지원 대상이 될 수 있습니다.",청년내일채움공제
제가 운영하는 제조업 중소기업에서 새로운 인력을 채용하려고 할 때 청년내일채움공제 관련 조건은 무엇인가요?,"귀하의 중소기업이 5인 이상 50인 미만 직원을 두고 있으며, 채용할 청년이 최종학교를 졸업한 후 12개월 이내 고용보험에 가입하고 월 임금이 300만 원 이하여야 합니다.",청년내일채움공제
청년 내일채움공제의 삼자 공동 적립금 규모는 얼마인가요?,"청년내일채움공제의 삼자 공동 적립금은 총 1200만 원으로 청년, 기업, 정부가 각각 400만 원씩 적립합니다.",청년내일채움공제
